title,author,journal,year,doi,ID,study,source,exclude_title,exclude_reason,include,entered
phylogeny matters: revisiting 'a comparison of bats and rodents as reservoirs of zoonotic viruses',Guy et al.,Royal Society Open Science,2019,10.1098/rsos.181182,709,Guy et al. 2019 Royal Society Open Science,WOS,,,,
phytostabilization of store-and-release cover made with phosphate mine wastes in arid and semiarid climate using wild local plants,Hamza et al.,Remediation-the Journal of Environmental Cleanup Costs Technologies & Techniques,2020,10.1002/rem.21662,710,Hamza et al. 2020 Remediation-the Journal of Environmental Cleanup Costs Technologies & Techniques,WOS,,,,
population dynamics of alabama beach mice (peromyscus polionotus ammobates) following hurricane opal,Swilling et al.,American Midland Naturalist,1998,10.1674/0003-0031(1998)140[0287:PDOABM]2.0.CO;2,711,Swilling et al. 1998 American Midland Naturalist,WOS,,,,
"population numbers, density and activity patterns of servals in savannah patches of odzala-kokoua national park, republic of congo",Bohm & Hofer,African Journal of Ecology,2018,10.1111/aje.12520,712,Bohm & Hofer 2018 African Journal of Ecology,WOS,,,,
possibility for reverse zoonotic transmission of sars-cov-2 to free-ranging wildlife: a case study of bats,Olival et al.,Plos Pathog,2020,10.1371/journal.ppat.1008758,713,Olival et al. 2020 Plos Pathog,PubMed,,,,
possible bat origin of severe acute respiratory syndrome coronavirus 2,Lau et al.,Emerg Infect Dis,2020,10.3201/eid2607.200092,714,Lau et al. 2020 Emerg Infect Dis,PubMed,,,,
potent mers-cov fusion inhibitory peptides identified from hr2 domain in spike protein of bat coronavirus hku4,Xia et al.,Viruses,2019,10.3390/v11010056,715,Xia et al. 2019 Viruses,PubMed,,,,
potential antiviral drugs for sars-cov-2 treatment: preclinical findings and ongoing clinical research,Bimonte et al.,In Vivo,2020,10.21873/invivo.11949,716,Bimonte et al. 2020 In Vivo,PubMed,,,,
potential factors influencing repeated sars outbreaks in china,Sun et al.,International Journal of Environmental Research and Public Health,2020,10.3390/ijerph17051633,717,Sun et al. 2020 International Journal of Environmental Research and Public Health,WOS,,,,
potential genotypes of the 1995 rrim hevea germplasm collection for future rubber breeding and selection programme,Adifaiz et al.,Journal of Rubber Research,2017,10.1007/BF03449155,718,Adifaiz et al. 2017 Journal of Rubber Research,WOS,,,,
potential net effects of climate change on high arctic peary caribou: lessons from a spatially explicit simulation model,Tews et al.,Ecological Modelling,2007,10.1016/j.ecolmodel.2007.04.011,719,Tews et al. 2007 Ecological Modelling,WOS,,,,
"potential of large ""first generation"" human-to-human transmission of 2019-ncov",Li et al.,J Med Virol,2020,10.1002/jmv.25693,720,Li et al. 2020 J Med Virol,PubMed,,,,
potential therapeutic targeting of coronavirus spike glycoprotein priming,Barile et al.,Molecules,2020,10.3390/molecules25102424,721,Barile et al. 2020 Molecules,PubMed,,,,
potential zoonotic origins of sars-cov-2 and insights for preventing future pandemics through one health approach,Konda et al.,Cureus,2020,10.7759/cureus.8932,722,Konda et al. 2020 Cureus,WOS,,,,
poxviruses in bats ... so what?,Baker & Murcia,Viruses-basel,2014,10.3390/v6041564,723,Baker & Murcia 2014 Viruses-basel,WOS,,,,
"predicting preferences for sex acts: which traits matter most, and why?",Peterson et al.,Evolutionary Psychology,2011,,724,Peterson et al. 2011 Evolutionary Psychology,WOS,,,,
prevalence and genetic diversity of coronaviruses in bats from china,Tang et al.,Journal of Virology,2006,10.1128/JVI.00697-06,725,Tang et al. 2006 Journal of Virology,WOS,,,,
prevalence of rabies and lpm paramyxovirus antibody in non-hematophagous bats captured in the central pacific coast of mexico,Salas-Rojas et al.,Transactions of the Royal Society of Tropical Medicine and Hygiene,2004,10.1016/j.trstmh.2003.10.019,726,Salas-Rojas et al. 2004 Transactions of the Royal Society of Tropical Medicine and Hygiene,CAB,,,,
preventing bat-born viral outbreaks in future using ecological interventions,Ghulam Nabi et al.,Environmental Research,2020,10.1016/j.envres.2020.109460,727,Ghulam Nabi et al. 2020 Environmental Research,CAB,,,,
primary and secondary sources of emerging and already well known zoonotic viruses,Truszczyn´ski & Pejsak,Zycie Weterynaryjne,2015,,728,Truszczyn´ski & Pejsak 2015 Zycie Weterynaryjne,CAB,,,,
probable pangolin origin of sars-cov-2 associated with the covid-19 outbreak,Zhang et al.,Curr Biol,2020,10.1016/j.cub.2020.03.022,729,Zhang et al. 2020 Curr Biol,PubMed,,,,
properties of coronavirus and sars-cov-2,Malik,Malays J Pathol,2020,,730,Malik 2020 Malays J Pathol,PubMed,,,,
protease-activated receptor 2 mediates mucus secretion in the airway submucosal gland,Lee et al.,Plos One,2012,10.1371/journal.pone.0043188,731,Lee et al. 2012 Plos One,WOS,,,,
protected areas in boreal canada: a baseline and considerations for the continued development of a representative and effective reserve network,Andrew et al.,Environmental Reviews,2014,10.1139/er-2013-0056,732,Andrew et al. 2014 Environmental Reviews,WOS,,,,
protein structure and sequence reanalysis of 2019-ncov genome refutes snakes as its intermediate host and the unique similarity between its spike protein insertions and hiv-1,Zhang et al.,J Proteome Res,2020,10.1021/acs.jproteome.0c00129,733,Zhang et al. 2020 J Proteome Res,PubMed,,,,
"pseudo-nitzschia, nitzschia, and domoic acid: new research since 2011",Bates et al.,Harmful Algae,2018,10.1016/j.hal.2018.06.001,734,Bates et al. 2018 Harmful Algae,CAB,,,,
"public attitudes toward the presence and management of bats roosting in buildings in great smoky mountains national park, southeastern united states",Fagan et al.,Biological Conservation,2018,10.1016/j.biocon.2018.02.004,735,Fagan et al. 2018 Biological Conservation,WOS,,,,
public health awareness of emerging zoonotic viruses of bats: a european perspective,Van et al.,Vector Borne Zoonotic Dis,2006,10.1089/vbz.2006.6.315,736,Van et al. 2006 Vector Borne Zoonotic Dis,PubMed,Y,general review,,
public health risk and transmission route of middle east respiratory syndrome (mers): mers coronavirus in dromedary camel,Andualem Yimer & Sisay Fanta,Journal of Veterinary Medicine and Animal Health,2017,10.5897/JVMAH2016.0519,737,Andualem Yimer & Sisay Fanta 2017 Journal of Veterinary Medicine and Animal Health,CAB,Y,molecular,,
putative receptor binding domain of bat-derived coronavirus hku9 spike protein: evolution of betacoronavirus receptor binding motifs,Huang et al.,Biochemistry,2016,10.1021/acs.biochem.6b00790,738,Huang et al. 2016 Biochemistry,PubMed,Y,molecular,,
quantifying global drivers of zoonotic bat viruses: a process-based perspective,Brierley et al.,American Naturalist,2016,10.1086/684391,739,Brierley et al. 2016 American Naturalist,WOS,Y,batcov review,,
quantifying the differences in avian attack rates on reptiles between an infrastructure and a control site,Law et al.,European Journal of Wildlife Research,2020,10.1007/s10344-020-01393-y,740,Law et al. 2020 European Journal of Wildlife Research,WOS,Y,not batcov,,
rabies,NA et al.,,1988,,741,NA et al. 1988 ,CAB,Y,not batcov,,
rabies in east and southeast asia: a mirror of the global situation,Lechenne et al.,Neglected Tropical Diseases - East Asia,2019,10.1007/978-3-030-12008-5_6,742,Lechenne et al. 2019 Neglected Tropical Diseases - East Asia,WOS,Y,not batcov,,
rabies surveillance in poland (1992-2006),Smreczak et al.,Towards The Elimination of Rabies In Eurasia,2008,,743,Smreczak et al. 2008 Towards The Elimination of Rabies In Eurasia,WOS,Y,not batcov,,
"rabies vaccination campaigns in dogs and cats, and rabies positivity in bats, from 2004 to 2014, in campinas, são paulo, brazil",Rodrigues et al.,Epidemiologia e Serviços de Saúde,2017,,744,Rodrigues et al. 2017 Epidemiologia e Serviços de Saúde,CAB,Y,not batcov,,
rapid detection of mers coronavirus-like viruses in bats: pote1ntial for tracking mers coronavirus transmission and animal origin,Woo et al.,Emerg Microbes Infect,2018,10.1038/s41426-017-0016-7,745,Woo et al. 2018 Emerg Microbes Infect,PubMed,N,,Y,
rapid molecular species identification of indigenous bats from germany for surveillance purposes,Schlottau et al.,"Infection, Genetics and Evolution",2020,10.1016/j.meegid.2019.104140,746,"Schlottau et al. 2020 Infection, Genetics and Evolution",CAB,Y,no cov,,
recent developments in the virology and antiviral research of severe acute respiratory syndrome coronavirus,Yeung & Meanwell,Infect Disord Drug Targets,2007,10.2174/187152607780090739,747,Yeung & Meanwell 2007 Infect Disord Drug Targets,PubMed,Y,general review,,
"recent transmission of a novel alphacoronavirus, bat coronavirus hku10, from leschenault's rousettes to pomona leaf-nosed bats: first evidence of interspecies transmission of coronavirus between bats of different suborders",Lau et al.,J Virol,2012,10.1128/JVI.01305-12,748,Lau et al. 2012 J Virol,PubMed,N,,Y,
receptor recognition by the novel coronavirus from wuhan: an analysis based on decade-long structural studies of sars coronavirus,Wan et al.,J Virol,2020,10.1128/JVI.00127-20,749,Wan et al. 2020 J Virol,PubMed,Y,molecular,,
receptor usage and cell entry of bat coronavirus hku4 provide insight into bat-to-human transmission of mers coronavirus,Yang et al.,Proc Natl Acad Sci U S a,2014,10.1073/pnas.1405889111,750,Yang et al. 2014 Proc Natl Acad Sci U S a,PubMed,Y,molecular,,
receptor usage and cell entry of porcine epidemic diarrhea coronavirus,Liu et al.,J Virol,2015,10.1128/JVI.00430-15,751,Liu et al. 2015 J Virol,PubMed,Y,molecular,,
receptor usage of a novel bat lineage c betacoronavirus reveals evolution of middle east respiratory syndrome-related coronavirus spike proteins for human dipeptidyl peptidase 4 binding,Lau et al.,J Infect Dis,2018,10.1093/infdis/jiy018,752,Lau et al. 2018 J Infect Dis,PubMed,Y,molecular,,
receptor variation and susceptibility to middle east respiratory syndrome coronavirus infection,Barlan et al.,J Virol,2014,10.1128/JVI.00161-14,753,Barlan et al. 2014 J Virol,PubMed,Y,molecular,,
"recombination, reservoirs, and the modular spike: mechanisms of coronavirus cross-species transmission",Graham & Baric,Journal of Virology,2010,10.1128/JVI.01394-09,754,Graham & Baric 2010 Journal of Virology,CAB,Y,molecular,,
"recommendations to diminish the coexistence of the house bat (molossus molossus pallas, 1776) with the human population in the city of sincelejo, department of sucre, colombia",Alcides C. & Caty M.,Revista Colombiana de Ciencia Animal,2009,,755,Alcides C. & Caty M. 2009 Revista Colombiana de Ciencia Animal,CAB,Y,no cov,,
"record of six species of mudskippers (gobiidae : oxudercinae) from the mangroves of bhitarkanika, odisha, east coast of india",Das & Palita,Indian Journal of Geo-marine Sciences,2015,,756,Das & Palita 2015 Indian Journal of Geo-marine Sciences,WOS,Y,not batcov,,
regional analysis of wind turbine-caused bat mortality,Drake et al.,Acta Chiropterologica,2015,10.3161/15081109ACC2015.17.1.015,757,Drake et al. 2015 Acta Chiropterologica,WOS,Y,no cov,,
regulating wildlife conservation and food safety to prevent human exposure to novel virus,Yuan et al.,Ecosystem Health and Sustainability,2020,10.1080/20964129.2020.1741325,758,Yuan et al. 2020 Ecosystem Health and Sustainability,WOS,Y,general review,,
"relationships between bat occupancy and habitat and landscape structure along a savanna, woodland, forest gradient in the missouri ozarks",Starbuck et al.,Wildlife Society Bulletin,2015,10.1002/wsb.512,759,Starbuck et al. 2015 Wildlife Society Bulletin,WOS,Y,no cov,,
release of severe acute respiratory syndrome coronavirus nuclear import block enhances host transcription in human lung cells,Sims et al.,Journal of Virology,2013,10.1128/JVI.02520-12,760,Sims et al. 2013 Journal of Virology,WOS,Y,molecular,,
replacement of bath tryptophan residues at 388 and 412 completely abolished cytochalasin-b photolabeling of the glut1 glucose-transporter,Inukai et al.,Biochemical Journal,1994,10.1042/bj3020355,761,Inukai et al. 1994 Biochemical Journal,WOS,Y,not batcov,,
replication and shedding of mers-cov in jamaican fruit bats (artibeus jamaicensis),Munster et al.,Sci Rep,2016,10.1038/srep21878,762,Munster et al. 2016 Sci Rep,PubMed,,,,
replication of mers and sars coronaviruses in bat cells offers insights to their ancestral origins,Lau et al.,Emerg Microbes Infect,2018,10.1038/s41426-018-0208-9,763,Lau et al. 2018 Emerg Microbes Infect,PubMed,,,,
reptile and amphibian responses to large-scale wildfires in southern california,Rochester et al.,Journal of Herpetology,2010,10.1670/08-143.1,764,Rochester et al. 2010 Journal of Herpetology,WOS,Y,not batcov,,
research on anti-camouflaged target system based on spectral detection and image recognition,Wang bo et al.,Spectroscopy and Spectral Analysis,2015,10.3964/j.issn.1000-0593(2015)05-1440-05,765,Wang bo et al. 2015 Spectroscopy and Spectral Analysis,WOS,Y,not batcov,,
research progress on natural infection of bat with the emerging viruses in china,Zhang HaiLin,Zhongguo Meijie Shengwuxue ji Kongzhi Zazhi = Chinese Journal of Vector Biology and Control,2015,,766,Zhang HaiLin 2015 Zhongguo Meijie Shengwuxue ji Kongzhi Zazhi = Chinese Journal of Vector Biology and Control,CAB,,,,
"research progress on natural infection of bat with zoonosis-related viral pathogens in yunnan province, china",Zhang HaiLin et al.,Chinese Journal of Zoonoses,2017,,767,Zhang HaiLin et al. 2017 Chinese Journal of Zoonoses,CAB,,,,
reservoirs and vectors of emerging viruses,Mackenzie & Jeggo,Current Opinion In Virology,2013,10.1016/j.coviro.2013.02.002,768,Mackenzie & Jeggo 2013 Current Opinion In Virology,WOS,Y,not batcov,,
resistance to antiparasitic drugs: the role of molecular diagnosis,Sangster et al.,International Journal for Parasitology,2002,10.1016/S0020-7519(01)00365-4,769,Sangster et al. 2002 International Journal for Parasitology,CAB,Y,not batcov,,
resource selection and space use of myotis evotis in a western juniper woodland in oregon,Anthony & Sanchez,Journal of Mammalogy,2019,10.1093/jmammal/gyy150,770,Anthony & Sanchez 2019 Journal of Mammalogy,WOS,Y,no cov,,
resource selection by indiana bats during the maternity season,Womack et al.,Journal of Wildlife Management,2013,10.1002/jwmg.498,771,Womack et al. 2013 Journal of Wildlife Management,WOS,Y,no cov,,
retained satellite information influences performance of gps devices in a forested ecosystem,Moriarty & Epps,Wildlife Society Bulletin,2015,10.1002/wsb.524,772,Moriarty & Epps 2015 Wildlife Society Bulletin,WOS,Y,not batcov,,
retrospective detection and phylogenetic analysis of swine acute diarrhoea syndrome coronavirus in pigs in southern china,Zhou et al.,Transbound Emerg Dis,2019,10.1111/tbed.13008,773,Zhou et al. 2019 Transbound Emerg Dis,PubMed,Y,not batcov,,
review of bats and sars,Wang et al.,Emerg Infect Dis,2006,10.3201/eid1212.060401,774,Wang et al. 2006 Emerg Infect Dis,PubMed,Y,general review,,
revised state wildlife action plans offer new opportunities for pollinator conservation in the usa,Mawdsley & Humpert,Natural Areas Journal,2016,10.3375/043.036.0411,775,Mawdsley & Humpert 2016 Natural Areas Journal,WOS,Y,not batcov,,
rewilding immunology,Flies,Science,2020,10.1126/science.abb8664,776,Flies 2020 Science,PubMed,Y,general review,,
rhabdovirus-based vaccine platforms against henipaviruses,Kurup et al.,Journal of Virology,2015,10.1128/JVI.02308-14,777,Kurup et al. 2015 Journal of Virology,WOS,Y,not batcov,,
rigorous wildlife disease surveillance,Watsa,Science,2020,10.1126/science.abc0017,778,Watsa 2020 Science,PubMed,Y,not batcov,,
risk factors and characteristics of h5n1 highly pathogenic avian influenza (hpai) post-vaccination outbreaks,Henning et al.,Veterinary Research,2009,10.1051/vetres:2008053,779,Henning et al. 2009 Veterinary Research,CAB,Y,not batcov,,
road rage and rs2477: judicial and administrative responsibility for resolving road claims on public lands,Birdsong,Hastings Law Journal,2005,,780,Birdsong 2005 Hastings Law Journal,WOS,Y,not batcov,,
roadside foraging by kangaroo rats in a grazed short-grass prairie landscape,Stapp & Lindquist,Western North American Naturalist,2007,10.3398/1527-0904(2007)67[368:RFBKRI]2.0.CO;2,781,Stapp & Lindquist 2007 Western North American Naturalist,WOS,Y,not batcov,,
role of the gtngtkr motif in the n-terminal receptor-binding domain of the sars-cov-2 spike protein,Behloul et al.,Virus Res,2020,10.1016/j.virusres.2020.198058,782,Behloul et al. 2020 Virus Res,PubMed,Y,molecular,,
roost selection by male indiana myotis following forest fires in central appalachian hardwoods forests,Johnson et al.,Journal of Fish and Wildlife Management,2010,10.3996/042010-JFWM-007,783,Johnson et al. 2010 Journal of Fish and Wildlife Management,WOS,Y,no cov,,
roost selection in suburban bushland by the urban sensitive bat nyctophilus gouldi,Threlfall et al.,Journal of Mammalogy,2013,10.1644/11-MAMM-A-393.1,784,Threlfall et al. 2013 Journal of Mammalogy,WOS,Y,no cov,,
rooting the phylogenetic tree of middle east respiratory syndrome coronavirus by characterization of a conspecific virus from an african bat,Corman et al.,J Virol,2014,10.1128/JVI.01498-14,785,Corman et al. 2014 J Virol,PubMed,,,,
salmonella typhimurium apparently perceives external nitrogen limitation as internal glutamine limitation,Ikeda et al.,Journal of Molecular Biology,1996,10.1006/jmbi.1996.0342,786,Ikeda et al. 1996 Journal of Molecular Biology,WOS,Y,not batcov,,
sars coronavirus redux,Qing & Gallagher,Trends Immunol,2020,10.1016/j.it.2020.02.007,787,Qing & Gallagher 2020 Trends Immunol,PubMed,Y,general review,,
sars molecular epidemiology: a chinese fairy tale of controlling an emerging zoonotic disease in the genomics era,Zhao GuoPing,,2007,10.1098/rstb.2007.2034,788,Zhao GuoPing 2007 ,CAB,Y,general review,,
sars-coronavirus ancestor's foot-prints in south-east asian bat colonies and the refuge theory,Gouilh et al.,Infect Genet Evol,2011,10.1016/j.meegid.2011.06.021,789,Gouilh et al. 2011 Infect Genet Evol,PubMed,,,,
sars-cov and emergent coronaviruses: viral determinants of interspecies transmission,Bolles et al.,Curr Opin Virol,2011,10.1016/j.coviro.2011.10.012,790,Bolles et al. 2011 Curr Opin Virol,PubMed,,,,
sars-cov related betacoronavirus and diverse alphacoronavirus members found in western old-world,Ar et al.,Virology,2018,10.1016/j.virol.2018.01.014,791,Ar et al. 2018 Virology,PubMed,,,,
"sars-cov-2 (covid-19) pandemic: a critical review on novel coronavirus pathogenesis, clinical diagnosis and treatment",Ruchi Jain et al.,Journal of Drug Delivery and Therapeutics,2020,10.22270/jddt.v10i3.3985,792,Ruchi Jain et al. 2020 Journal of Drug Delivery and Therapeutics,CAB,,,,
sars-cov-2 and bat ratg13 spike glycoprotein structures inform on virus evolution and furin-cleavage effects,Wrobel et al.,Nat Struct Mol Biol,2020,10.1038/s41594-020-0468-7,793,Wrobel et al. 2020 Nat Struct Mol Biol,PubMed,,,,
sars-cov-2 and other emerging viruses and their relationship to safety in the food chain,Silva-Jaimes,Scientia Agropecuaria,2020,10.17268/sci.agropecu.2020.02.15,794,Silva-Jaimes 2020 Scientia Agropecuaria,CAB,,,,
sars-cov-2 envelope and membrane proteins: structural differences linked to virus characteristics?,Bianchi et al.,Biomed Res Int,2020,10.1155/2020/4389089,795,Bianchi et al. 2020 Biomed Res Int,PubMed,,,,
"sars-cov-2 pandemic: causes and current situation, historical lessons, and strategical therapeutic interventions",Shereen & Kazmi,Biomedical Research and Therapy,2020,10.15419/bmrat.v7i5.608,796,Shereen & Kazmi 2020 Biomedical Research and Therapy,WOS,,,,
sars-cov-2 spike protein favors ace2 from bovidae and cricetidae,Luan JunWen et al.,Journal of Medical Virology,2020,10.1002/jmv.25817,797,Luan JunWen et al. 2020 Journal of Medical Virology,CAB,,,,
sars-cov-2: an emerging coronavirus that causes a global threat,Zheng,Int J Biol Sci,2020,10.7150/ijbs.45053,798,Zheng 2020 Int J Biol Sci,PubMed,,,,
sars-like coronavirus wiv1-cov does not replicate in egyptian fruit bats (rousettus aegyptiacus),Van et al.,Viruses,2018,10.3390/v10120727,799,Van et al. 2018 Viruses,PubMed,,,,
sars-like wiv1-cov poised for human emergence,Menachery et al.,Proc Natl Acad Sci U S a,2016,10.1073/pnas.1517719113,800,Menachery et al. 2016 Proc Natl Acad Sci U S a,PubMed,,,,
sars-unique fold in the rousettus bat coronavirus hku9,Hammond et al.,Protein Sci,2017,10.1002/pro.3208,801,Hammond et al. 2017 Protein Sci,PubMed,,,,
say no to bat fried rice: changing the narrative of coronavirus and chinese food,King,Food and Foodways,2020,10.1080/07409710.2020.1794182,802,King 2020 Food and Foodways,WOS,Y,general review,,
scientific statement on the coverage of bats by the current pesticide risk assessment for birds and mammals,Hernandez-jerez et al.,Efsa Journal,2019,10.2903/j.efsa.2019.5758,803,Hernandez-jerez et al. 2019 Efsa Journal,WOS,Y,no cov,,
screening for pain phenotypes: analysis of three congenic mouse strains on a battery of nine nociceptive assays,Mogil et al.,Pain,2006,10.1016/j.pain.2006.06.004,804,Mogil et al. 2006 Pain,WOS,Y,not batcov,,
searcher efficiency and survey coverage affect precision of fatality estimates,Reyes et al.,Journal of Wildlife Management,2016,10.1002/jwmg.21126,805,Reyes et al. 2016 Journal of Wildlife Management,WOS,Y,not batcov,,
"seasonal differences in foraging dynamics, habitat use and home range size of wahlberg's epauletted fruit bat in an urban environment",Rollinson et al.,African Zoology,2013,10.3377/004.048.0218,806,Rollinson et al. 2013 African Zoology,WOS,Y,no cov,,
"seasonal fluctuations of astrovirus, but not coronavirus shedding in bats inhabiting human-modified tropical forests",Seltmann et al.,Ecohealth,2017,10.1007/s10393-017-1245-x,807,Seltmann et al. 2017 Ecohealth,WOS,N,,Y,
selection of roosting and foraging habitat by bats in different-aged aspen mixedwood stands,Crampton & Barclay,Conservation Biology,1998,10.1046/j.1523-1739.1998.97209.x,808,Crampton & Barclay 1998 Conservation Biology,WOS,Y,no cov,,
selection of viral variants during persistent infection of insectivorous bat cells with middle east respiratory syndrome coronavirus,Banerjee et al.,Scientific Reports,2020,10.1038/s41598-020-64264-1,809,Banerjee et al. 2020 Scientific Reports,WOS,,,,
"selection, evolution of behavior and animal models in behavioral neuroscience",Parmigiani et al.,Neuroscience and Biobehavioral Reviews,1999,10.1016/S0149-7634(99)00029-9,810,Parmigiani et al. 1999 Neuroscience and Biobehavioral Reviews,WOS,Y,not batcov,,
"sensitivity of populations of bats (mammalia: chiroptera) in relation to human development in northern parana, southern brazil",Reis et al.,Brazilian Journal of Biology,2012,10.1590/S1519-69842012000300014,811,Reis et al. 2012 Brazilian Journal of Biology,WOS,Y,no cov,,
"serological evidence of bat sars-related coronavirus infection in humans, china",Wang Ning et al.,Virologica Sinica,2018,10.1007/s12250-018-0012-7,812,Wang Ning et al. 2018 Virologica Sinica,CAB,Y,no cov,,
serological evidence of mers-cov and hku8-related cov co-infection in kenyan camels,Zhang et al.,Emerg Microbes Infect,2019,10.1080/22221751.2019.1679610,813,Zhang et al. 2019 Emerg Microbes Infect,PubMed,Y,no bat,,
serological evidence of toxoplasma gondii infection in five species of bats in china,Yuan et al.,Vector Borne Zoonotic Dis,2013,10.1089/vbz.2012.1091,814,Yuan et al. 2013 Vector Borne Zoonotic Dis,PubMed,Y,no cov,,
serum-free transient protein production system based on adenoviral vector and per.c6 technology: high yield and preserved bioactivity,Havenga et al.,Biotechnology and Bioengineering,2008,10.1002/bit.21757,815,Havenga et al. 2008 Biotechnology and Bioengineering,WOS,Y,not batcov,,
severe acute respiratory syndrome (sars) coronavirus orf8 protein is acquired from sars-related coronavirus from greater horseshoe bats through recombination,Lau et al.,J Virol,2015,10.1128/JVI.01048-15,816,Lau et al. 2015 J Virol,PubMed,,,,
severe acute respiratory syndrome coronavirus as an agent of emerging and reemerging infection,Cheng et al.,Clinical Microbiology Reviews,2007,10.1128/CMR.00023-07,817,Cheng et al. 2007 Clinical Microbiology Reviews,WOS,,,,
severe acute respiratory syndrome coronavirus-like virus in chinese horseshoe bats,Lau et al.,Proceedings of The National Academy of Sciences of The United States of America,2005,10.1073/pnas.0506735102,818,Lau et al. 2005 Proceedings of The National Academy of Sciences of The United States of America,WOS,N,,Y,
severe acute respiratory syndrome vs the middle east respiratory syndrome,Hui et al.,Current Opinion in Pulmonary Medicine,2014,10.1097/MCP.0000000000000046,819,Hui et al. 2014 Current Opinion in Pulmonary Medicine,CAB,,,,
sex-specific foraging habits and roost characteristics of nycticeius humeralis in north-central arkansas,Istvanko et al.,Journal of Mammalogy,2016,10.1093/jmammal/gyw102,820,Istvanko et al. 2016 Journal of Mammalogy,WOS,Y,no bat,,
shrub encroachment affects mammalian carnivore abundance and species richness in semiarid rangelands,Blaum et al.,Acta Oecologica-international Journal of Ecology,2007,10.1016/j.actao.2006.10.004,821,Blaum et al. 2007 Acta Oecologica-international Journal of Ecology,WOS,Y,not batcov,,
"simultaneous detection of severe acute respiratory syndrome, middle east respiratory syndrome, and related bat coronaviruses by real-time reverse transcription pcr",Noh et al.,Arch Virol,2017,10.1007/s00705-017-3281-9,822,Noh et al. 2017 Arch Virol,PubMed,N,,Y,
