Title,Authors,Corporate Authors,Editors,Book Editors,Source Title,Publication Date,Publication Year,Volume,Issue,Part Number,Supplement,Special Issue,Beginning Page,Ending Page,Article Number,DOI,Conference Title,Conference Date,Total Citations,Average per Year,1900,1901,1902,1903,1904,1905,1906,1907,1908,1909,1910,1911,1912,1913,1914,1915,1916,1917,1918,1919,1920,1921,1922,1923,1924,1925,1926,1927,1928,1929,1930,1931,1932,1933,1934,1935,1936,1937,1938,1939,1940,1941,1942,1943,1944,1945,1946,1947,1948,1949,1950,1951,1952,1953,1954,1955,1956,1957,1958,1959,1960,1961,1962,1963,1964,1965,1966,1967,1968,1969,1970,1971,1972,1973,1974,1975,1976,1977,1978,1979,1980,1981,1982,1983,1984,1985,1986,1987,1988,1989,1990,1991,1992,1993,1994,1995,1996,1997,1998,1999,2000,2001,2002,2003,2004,2005,2006,2007,2008,2009,2010,2011,2012,2013,2014,2015,2016,2017,2018,2019,2020,2021
Structural features of covalently cross-linked hydroxylase and reductase proteins of soluble methane monooxygenase as revealed by mass spectrometric analysis,"Kopp, DA; Berg, EA; Costello, CE; Lippard, SJ",,,,JOURNAL OF BIOLOGICAL CHEMISTRY,JUN 6 2003,2003,278,23,,,,20939,20945,,10.1074/jbc.M301581200,,,12,0.67,0,0,0,0,0,0,0,0,0,0,0,0,0,0,0,0,0,0,0,0,0,0,0,0,0,0,0,0,0,0,0,0,0,0,0,0,0,0,0,0,0,0,0,0,0,0,0,0,0,0,0,0,0,0,0,0,0,0,0,0,0,0,0,0,0,0,0,0,0,0,0,0,0,0,0,0,0,0,0,0,0,0,0,0,0,0,0,0,0,0,0,0,0,0,0,0,0,0,0,0,0,0,0,0,1,2,4,0,0,0,1,0,0,0,1,1,0,1,0,1,0,0
Uneven recombination rate and linkage disequilibrium across a reference SNP map for common bean (Phaseolus vulgaris L.),"Blair, Matthew W.; Cortes, Andres J.; Farmer, Andrew D.; Huang, Wei; Ambachew, Daniel; Penmetsa, R. Varma; Carrasquilla-Garcia, Noelia; Assefa, Teshale; Cannon, Steven B.",,,,PLOS ONE,MAR 9 2018,2018,13,3,,,,,,e0189597,10.1371/journal.pone.0189597,,,11,3.67,0,0,0,0,0,0,0,0,0,0,0,0,0,0,0,0,0,0,0,0,0,0,0,0,0,0,0,0,0,0,0,0,0,0,0,0,0,0,0,0,0,0,0,0,0,0,0,0,0,0,0,0,0,0,0,0,0,0,0,0,0,0,0,0,0,0,0,0,0,0,0,0,0,0,0,0,0,0,0,0,0,0,0,0,0,0,0,0,0,0,0,0,0,0,0,0,0,0,0,0,0,0,0,0,0,0,0,0,0,0,0,0,0,0,0,0,0,0,3,6,2,0
Anatomical and histological structure of the tongue and histochemical characteristics of the lingual salivary glands in the Persian squirrel (Sciurus anomalus),"Sadeghinezhad, Javad; Tootian, Zahra; Javadi, Faezeh",,,,ANATOMICAL SCIENCE INTERNATIONAL,JAN 2018,2018,93,1,,,,58,68,,10.1007/s12565-016-0367-5,,,11,3.67,0,0,0,0,0,0,0,0,0,0,0,0,0,0,0,0,0,0,0,0,0,0,0,0,0,0,0,0,0,0,0,0,0,0,0,0,0,0,0,0,0,0,0,0,0,0,0,0,0,0,0,0,0,0,0,0,0,0,0,0,0,0,0,0,0,0,0,0,0,0,0,0,0,0,0,0,0,0,0,0,0,0,0,0,0,0,0,0,0,0,0,0,0,0,0,0,0,0,0,0,0,0,0,0,0,0,0,0,0,0,0,0,0,0,0,0,0,0,3,2,6,0
Coordinated Control of Acoustical Field of View and Flight in Three-Dimensional Space for Consecutive Capture by Echolocating Bats during Natural Foraging,"Sumiya, Miwa; Fujioka, Emyo; Motoi, Kazuya; Kondo, Masaru; Hiryu, Shizuko",,,,PLOS ONE,JAN 13 2017,2017,12,1,,,,,,e0169995,10.1371/journal.pone.0169995,,,11,2.75,0,0,0,0,0,0,0,0,0,0,0,0,0,0,0,0,0,0,0,0,0,0,0,0,0,0,0,0,0,0,0,0,0,0,0,0,0,0,0,0,0,0,0,0,0,0,0,0,0,0,0,0,0,0,0,0,0,0,0,0,0,0,0,0,0,0,0,0,0,0,0,0,0,0,0,0,0,0,0,0,0,0,0,0,0,0,0,0,0,0,0,0,0,0,0,0,0,0,0,0,0,0,0,0,0,0,0,0,0,0,0,0,0,0,0,0,0,0,4,5,2,0
Development of multiplexed bead arrays for the simultaneous detection of nucleic acid from multiple viruses in bat samples,"Boyd, Victoria; Smith, Ina; Crameri, Gary; Burroughs, Amy L.; Durr, Peter A.; White, John; Cowled, Christopher; Marsh, Glenn A.; Wang, Lin-Fa",,,,JOURNAL OF VIROLOGICAL METHODS,OCT 2015,2015,223,,,,,5,12,,10.1016/j.jviromet.2015.07.004,,,11,1.83,0,0,0,0,0,0,0,0,0,0,0,0,0,0,0,0,0,0,0,0,0,0,0,0,0,0,0,0,0,0,0,0,0,0,0,0,0,0,0,0,0,0,0,0,0,0,0,0,0,0,0,0,0,0,0,0,0,0,0,0,0,0,0,0,0,0,0,0,0,0,0,0,0,0,0,0,0,0,0,0,0,0,0,0,0,0,0,0,0,0,0,0,0,0,0,0,0,0,0,0,0,0,0,0,0,0,0,0,0,0,0,0,0,0,0,0,4,2,4,1,0,0
Retained Satellite Information Influences Performance of GPS Devices in a Forested Ecosystem,"Moriarty, Katie M.; Epps, Clinton W.",,,,WILDLIFE SOCIETY BULLETIN,JUN 2015,2015,39,2,,,,349,357,,10.1002/wsb.524,,,11,1.83,0,0,0,0,0,0,0,0,0,0,0,0,0,0,0,0,0,0,0,0,0,0,0,0,0,0,0,0,0,0,0,0,0,0,0,0,0,0,0,0,0,0,0,0,0,0,0,0,0,0,0,0,0,0,0,0,0,0,0,0,0,0,0,0,0,0,0,0,0,0,0,0,0,0,0,0,0,0,0,0,0,0,0,0,0,0,0,0,0,0,0,0,0,0,0,0,0,0,0,0,0,0,0,0,0,0,0,0,0,0,0,0,0,0,0,0,2,2,1,4,2,0
The large 386-nt deletion in SARS-associated coronavirus: Evidence for quasispecies?,"Tang, Julian W.; Cheung, Jo L. K.; Chu, Ida M. T.; Sung, Joseph J. Y.; Peiris, Malik; Chan, Paul K. S.",,,,JOURNAL OF INFECTIOUS DISEASES,SEP 15 2006,2006,194,6,,,,808,813,,10.1086/507044,,,11,0.73,0,0,0,0,0,0,0,0,0,0,0,0,0,0,0,0,0,0,0,0,0,0,0,0,0,0,0,0,0,0,0,0,0,0,0,0,0,0,0,0,0,0,0,0,0,0,0,0,0,0,0,0,0,0,0,0,0,0,0,0,0,0,0,0,0,0,0,0,0,0,0,0,0,0,0,0,0,0,0,0,0,0,0,0,0,0,0,0,0,0,0,0,0,0,0,0,0,0,0,0,0,0,0,0,0,0,0,2,1,1,1,0,0,0,0,0,0,2,2,0,2,0
Cysteine substitutions reveal dual functions of the amino-terminal tail in cystic fibrosis transmembrane conductance regulator channel gating,"Fu, J; Kirk, KL",,,,JOURNAL OF BIOLOGICAL CHEMISTRY,SEP 21 2001,2001,276,38,,,,35660,35668,,10.1074/jbc.M105079200,,,11,0.55,0,0,0,0,0,0,0,0,0,0,0,0,0,0,0,0,0,0,0,0,0,0,0,0,0,0,0,0,0,0,0,0,0,0,0,0,0,0,0,0,0,0,0,0,0,0,0,0,0,0,0,0,0,0,0,0,0,0,0,0,0,0,0,0,0,0,0,0,0,0,0,0,0,0,0,0,0,0,0,0,0,0,0,0,0,0,0,0,0,0,0,0,0,0,0,0,0,0,0,0,0,0,2,0,1,1,2,0,0,2,0,1,0,0,1,0,0,1,0,0,0,0
Cowbird parasitism of Arizona Bell's Vireos (Vireo bellii arizonae) in a desert riparian landscape: Implications for cowbird management and riparian restoration,"Averill-Murray, A; Lynn, S; Morrison, ML",,,"Morrison, ML; Hall, LS; Robinson, SK; Rothstein, SI; Hahn, DC; Rich, TD",RESEARCH AND MANAGEMENT OF THE BROWN-HEADED COWBIRD IN WESTERN LANDSCAPES,1999,1999,,18,,,,109,120,,,Symposium on Research and Management of the Brown-Headed Cowbird in Western Landscapes,"OCT 23-25, 1997",11,0.5,0,0,0,0,0,0,0,0,0,0,0,0,0,0,0,0,0,0,0,0,0,0,0,0,0,0,0,0,0,0,0,0,0,0,0,0,0,0,0,0,0,0,0,0,0,0,0,0,0,0,0,0,0,0,0,0,0,0,0,0,0,0,0,0,0,0,0,0,0,0,0,0,0,0,0,0,0,0,0,0,0,0,0,0,0,0,0,0,0,0,0,0,0,0,0,0,0,0,0,0,1,2,3,2,0,0,0,0,0,1,1,1,0,0,0,0,0,0,0,0,0,0
Poxviruses in Bats ... so What?,"Baker, Kate S.; Murcia, Pablo R.",,,,VIRUSES-BASEL,APR 2014,2014,6,4,,,,1564,1577,,10.3390/v6041564,,,10,1.43,0,0,0,0,0,0,0,0,0,0,0,0,0,0,0,0,0,0,0,0,0,0,0,0,0,0,0,0,0,0,0,0,0,0,0,0,0,0,0,0,0,0,0,0,0,0,0,0,0,0,0,0,0,0,0,0,0,0,0,0,0,0,0,0,0,0,0,0,0,0,0,0,0,0,0,0,0,0,0,0,0,0,0,0,0,0,0,0,0,0,0,0,0,0,0,0,0,0,0,0,0,0,0,0,0,0,0,0,0,0,0,0,0,0,1,1,2,4,0,1,1,0
"Assessment of small mammal diversity in coffee agroforestry in the Western Ghats, India","Caudill, S. Amanda; Vaast, Philippe; Husband, Thomas P.",,,,AGROFORESTRY SYSTEMS,FEB 2014,2014,88,1,,,,173,186,,10.1007/s10457-013-9664-3,,,10,1.43,0,0,0,0,0,0,0,0,0,0,0,0,0,0,0,0,0,0,0,0,0,0,0,0,0,0,0,0,0,0,0,0,0,0,0,0,0,0,0,0,0,0,0,0,0,0,0,0,0,0,0,0,0,0,0,0,0,0,0,0,0,0,0,0,0,0,0,0,0,0,0,0,0,0,0,0,0,0,0,0,0,0,0,0,0,0,0,0,0,0,0,0,0,0,0,0,0,0,0,0,0,0,0,0,0,0,0,0,0,0,0,0,0,0,1,2,2,1,0,1,3,0
Do green roofs provide habitat for bats in urban areas?,"Pearce, Huma; Walters, Charlotte L.",,,,ACTA CHIROPTEROLOGICA,2012,2012,14,2,,,,469,478,,10.3161/150811012X661774,,,10,1.11,0,0,0,0,0,0,0,0,0,0,0,0,0,0,0,0,0,0,0,0,0,0,0,0,0,0,0,0,0,0,0,0,0,0,0,0,0,0,0,0,0,0,0,0,0,0,0,0,0,0,0,0,0,0,0,0,0,0,0,0,0,0,0,0,0,0,0,0,0,0,0,0,0,0,0,0,0,0,0,0,0,0,0,0,0,0,0,0,0,0,0,0,0,0,0,0,0,0,0,0,0,0,0,0,0,0,0,0,0,0,0,0,0,0,1,2,1,3,0,2,1,0
The influence of fire history on selection of foraging sites by barren-ground caribou,"Barrier, Tara A.; Johnson, Chris J.",,,,ECOSCIENCE,2012,2012,19,2,,,,177,188,,10.2980/19-2-3508,,,10,1.11,0,0,0,0,0,0,0,0,0,0,0,0,0,0,0,0,0,0,0,0,0,0,0,0,0,0,0,0,0,0,0,0,0,0,0,0,0,0,0,0,0,0,0,0,0,0,0,0,0,0,0,0,0,0,0,0,0,0,0,0,0,0,0,0,0,0,0,0,0,0,0,0,0,0,0,0,0,0,0,0,0,0,0,0,0,0,0,0,0,0,0,0,0,0,0,0,0,0,0,0,0,0,0,0,0,0,0,0,0,0,0,0,0,1,2,0,2,1,2,2,0,0
The catalytic domain of human neuropathy target esterase mediates an organophosphate-sensitive ionic conductance across liposome membranes,"Forshaw, PJ; Atkins, J; Ray, DE; Glynn, P",,,,JOURNAL OF NEUROCHEMISTRY,OCT 2001,2001,79,2,,,,400,406,,10.1046/j.1471-4159.2001.00562.x,,,10,0.5,0,0,0,0,0,0,0,0,0,0,0,0,0,0,0,0,0,0,0,0,0,0,0,0,0,0,0,0,0,0,0,0,0,0,0,0,0,0,0,0,0,0,0,0,0,0,0,0,0,0,0,0,0,0,0,0,0,0,0,0,0,0,0,0,0,0,0,0,0,0,0,0,0,0,0,0,0,0,0,0,0,0,0,0,0,0,0,0,0,0,0,0,0,0,0,0,0,0,0,0,0,0,0,3,1,0,1,1,1,0,1,0,1,0,0,0,0,0,0,1,0,0
The effect of cover on the behaviour of Japanese quail (Coturnix japonica),"Buchwalder, T; Wechsler, B",,,,APPLIED ANIMAL BEHAVIOUR SCIENCE,NOV 1997,1997,54,4,,,,335,343,,10.1016/S0168-1591(97)00031-2,,,10,0.42,0,0,0,0,0,0,0,0,0,0,0,0,0,0,0,0,0,0,0,0,0,0,0,0,0,0,0,0,0,0,0,0,0,0,0,0,0,0,0,0,0,0,0,0,0,0,0,0,0,0,0,0,0,0,0,0,0,0,0,0,0,0,0,0,0,0,0,0,0,0,0,0,0,0,0,0,0,0,0,0,0,0,0,0,0,0,0,0,0,0,0,0,0,0,0,0,0,0,0,0,0,1,0,0,0,2,2,0,1,0,2,0,0,0,0,1,0,1,0,0,0,0
Biodiversity conservation and armed conflict: a warfare ecology perspective,"Hanson, Thor",,,,ANNALS OF THE NEW YORK ACADEMY OF SCIENCES,OCT 2018,2018,1429,1,,,SI,50,65,,10.1111/nyas.13689,,,9,3,0,0,0,0,0,0,0,0,0,0,0,0,0,0,0,0,0,0,0,0,0,0,0,0,0,0,0,0,0,0,0,0,0,0,0,0,0,0,0,0,0,0,0,0,0,0,0,0,0,0,0,0,0,0,0,0,0,0,0,0,0,0,0,0,0,0,0,0,0,0,0,0,0,0,0,0,0,0,0,0,0,0,0,0,0,0,0,0,0,0,0,0,0,0,0,0,0,0,0,0,0,0,0,0,0,0,0,0,0,0,0,0,0,0,0,0,0,0,2,4,3,0
"Development of a one-step RT-PCR assay for detection of pancoronaviruses (alpha-, beta-, gamma- and delta-coronaviruses) using newly designed degenerate primers for porcine and avian 'fecal samples","Hu, Hui; Jung, Kwonil; Wang, Qiuhong; Saif, Linda J.; Vlasova, Anastasia N.",,,,JOURNAL OF VIROLOGICAL METHODS,JUN 2018,2018,256,,,,,116,122,,10.1016/j.jviromet.2018.02.021,,,9,3,0,0,0,0,0,0,0,0,0,0,0,0,0,0,0,0,0,0,0,0,0,0,0,0,0,0,0,0,0,0,0,0,0,0,0,0,0,0,0,0,0,0,0,0,0,0,0,0,0,0,0,0,0,0,0,0,0,0,0,0,0,0,0,0,0,0,0,0,0,0,0,0,0,0,0,0,0,0,0,0,0,0,0,0,0,0,0,0,0,0,0,0,0,0,0,0,0,0,0,0,0,0,0,0,0,0,0,0,0,0,0,0,0,0,0,0,0,0,0,4,5,0
Biotechnological conversion of methane to methanol: evaluation of progress and potential,"Bjorck, Charlotte E.; Dobson, Paul D.; Pandhal, Jagroop",,,,AIMS BIOENGINEERING,2018,2018,5,1,,,,1,38,,10.3934/bioeng.2018.1.1,,,9,3,0,0,0,0,0,0,0,0,0,0,0,0,0,0,0,0,0,0,0,0,0,0,0,0,0,0,0,0,0,0,0,0,0,0,0,0,0,0,0,0,0,0,0,0,0,0,0,0,0,0,0,0,0,0,0,0,0,0,0,0,0,0,0,0,0,0,0,0,0,0,0,0,0,0,0,0,0,0,0,0,0,0,0,0,0,0,0,0,0,0,0,0,0,0,0,0,0,0,0,0,0,0,0,0,0,0,0,0,0,0,0,0,0,0,0,0,0,0,1,5,3,0
Factors associated with bat mortality at wind energy facilities in the United States,"Thompson, Maureen; Beston, Julie A.; Etterson, Matthew; Diffendorfer, Jay E.; Loss, Scott R.",,,,BIOLOGICAL CONSERVATION,NOV 2017,2017,215,,,,,241,245,,10.1016/j.biocon.2017.09.014,,,9,2.25,0,0,0,0,0,0,0,0,0,0,0,0,0,0,0,0,0,0,0,0,0,0,0,0,0,0,0,0,0,0,0,0,0,0,0,0,0,0,0,0,0,0,0,0,0,0,0,0,0,0,0,0,0,0,0,0,0,0,0,0,0,0,0,0,0,0,0,0,0,0,0,0,0,0,0,0,0,0,0,0,0,0,0,0,0,0,0,0,0,0,0,0,0,0,0,0,0,0,0,0,0,0,0,0,0,0,0,0,0,0,0,0,0,0,0,0,0,0,1,3,5,0
Critical Assessment of the Important Residues Involved in the Dimerization and Catalysis of MERS Coronavirus Main Protease,"Ho, Bo-Lin; Cheng, Shu-Chun; Shi, Lin; Wang, Ting-Yun; Ho, Kuan-I; Chou, Chi-Yuan",,,,PLOS ONE,DEC 14 2015,2015,10,12,,,,,,e0144865,10.1371/journal.pone.0144865,,,9,1.5,0,0,0,0,0,0,0,0,0,0,0,0,0,0,0,0,0,0,0,0,0,0,0,0,0,0,0,0,0,0,0,0,0,0,0,0,0,0,0,0,0,0,0,0,0,0,0,0,0,0,0,0,0,0,0,0,0,0,0,0,0,0,0,0,0,0,0,0,0,0,0,0,0,0,0,0,0,0,0,0,0,0,0,0,0,0,0,0,0,0,0,0,0,0,0,0,0,0,0,0,0,0,0,0,0,0,0,0,0,0,0,0,0,0,0,0,0,5,1,0,3,0
Factors affecting acoustic detection and site occupancy of Indiana bats near a known maternity colony,"Kaiser, Zachary D. E.; O'Keefe, Joy M.",,,,JOURNAL OF MAMMALOGY,APR 2015,2015,96,2,,,,344,360,,10.1093/jmammal/gyv036,,,9,1.5,0,0,0,0,0,0,0,0,0,0,0,0,0,0,0,0,0,0,0,0,0,0,0,0,0,0,0,0,0,0,0,0,0,0,0,0,0,0,0,0,0,0,0,0,0,0,0,0,0,0,0,0,0,0,0,0,0,0,0,0,0,0,0,0,0,0,0,0,0,0,0,0,0,0,0,0,0,0,0,0,0,0,0,0,0,0,0,0,0,0,0,0,0,0,0,0,0,0,0,0,0,0,0,0,0,0,0,0,0,0,0,0,0,0,0,0,0,2,1,4,2,0
Androgenetic doubled haploids induced without irradiation of eggs in loach (Misgurnus anguillicaudatus),"Hou, Jilun; Saito, Taiju; Fujimoto, Takafumi; Yamaha, Etsuro; Arai, Katsutoshi",,,,AQUACULTURE,JAN 20 2014,2014,420,,,1,,S57,S63,,10.1016/j.aquaculture.2013.05.021,,,9,1.29,0,0,0,0,0,0,0,0,0,0,0,0,0,0,0,0,0,0,0,0,0,0,0,0,0,0,0,0,0,0,0,0,0,0,0,0,0,0,0,0,0,0,0,0,0,0,0,0,0,0,0,0,0,0,0,0,0,0,0,0,0,0,0,0,0,0,0,0,0,0,0,0,0,0,0,0,0,0,0,0,0,0,0,0,0,0,0,0,0,0,0,0,0,0,0,0,0,0,0,0,0,0,0,0,0,0,0,0,0,0,0,0,0,0,1,1,1,0,2,3,1,0
Protease-Activated Receptor 2 Mediates Mucus Secretion in the Airway Submucosal Gland,"Lee, Hyun Jae; Yang, Yu-Mi; Kim, Kyubo; Shin, Dong Min; Yoon, Joo-Heon; Cho, Hyung-Ju; Choi, Jae Young",,,,PLOS ONE,AUG 15 2012,2012,7,8,,,,,,e43188,10.1371/journal.pone.0043188,,,9,1,0,0,0,0,0,0,0,0,0,0,0,0,0,0,0,0,0,0,0,0,0,0,0,0,0,0,0,0,0,0,0,0,0,0,0,0,0,0,0,0,0,0,0,0,0,0,0,0,0,0,0,0,0,0,0,0,0,0,0,0,0,0,0,0,0,0,0,0,0,0,0,0,0,0,0,0,0,0,0,0,0,0,0,0,0,0,0,0,0,0,0,0,0,0,0,0,0,0,0,0,0,0,0,0,0,0,0,0,0,0,0,0,0,2,1,1,3,1,1,0,0,0
Determining Causality and Controlling Disease is Based on Collaborative Research involving Multidisciplinary Approaches,"Skerratt, L. F.; Garner, T. W. J.; Hyatt, A. D.",,,,ECOHEALTH,SEP 2009,2009,6,3,,,,331,334,,10.1007/s10393-010-0292-3,,,9,0.75,0,0,0,0,0,0,0,0,0,0,0,0,0,0,0,0,0,0,0,0,0,0,0,0,0,0,0,0,0,0,0,0,0,0,0,0,0,0,0,0,0,0,0,0,0,0,0,0,0,0,0,0,0,0,0,0,0,0,0,0,0,0,0,0,0,0,0,0,0,0,0,0,0,0,0,0,0,0,0,0,0,0,0,0,0,0,0,0,0,0,0,0,0,0,0,0,0,0,0,0,0,0,0,0,0,0,0,0,0,0,0,3,2,1,1,0,1,1,0,0,0,0
"Commercial sponge fishing in Libya: Historical records, present status and perspectives","Milanese, M.; Sara, A.; Manconic, R.; Ben Abdalla, A.; Pronzato, R.",,,,FISHERIES RESEARCH,JAN 2008,2008,89,1,,,,90,96,,10.1016/j.fishres.2007.09.018,,,9,0.69,0,0,0,0,0,0,0,0,0,0,0,0,0,0,0,0,0,0,0,0,0,0,0,0,0,0,0,0,0,0,0,0,0,0,0,0,0,0,0,0,0,0,0,0,0,0,0,0,0,0,0,0,0,0,0,0,0,0,0,0,0,0,0,0,0,0,0,0,0,0,0,0,0,0,0,0,0,0,0,0,0,0,0,0,0,0,0,0,0,0,0,0,0,0,0,0,0,0,0,0,0,0,0,0,0,0,0,0,1,1,1,3,0,0,0,0,0,0,1,1,1,0
A Wireless Sensor System for Long-Term Microclimate Monitoring in Wildland Cultural Heritage Sites,Xia Ming; Dong Yabo; Lu Dongming; Xue Ping; Liu Gang,,,,PROCEEDINGS OF THE 2008 INTERNATIONAL SYMPOSIUM ON PARALLEL AND DISTRIBUTED PROCESSING WITH APPLICATIONS,2008,2008,,,,,,207,+,,10.1109/ISPA.2008.75,IEEE International Symposium on Parallel and Distributed Processing with Applications,"DEC 10-12, 2008",9,0.69,0,0,0,0,0,0,0,0,0,0,0,0,0,0,0,0,0,0,0,0,0,0,0,0,0,0,0,0,0,0,0,0,0,0,0,0,0,0,0,0,0,0,0,0,0,0,0,0,0,0,0,0,0,0,0,0,0,0,0,0,0,0,0,0,0,0,0,0,0,0,0,0,0,0,0,0,0,0,0,0,0,0,0,0,0,0,0,0,0,0,0,0,0,0,0,0,0,0,0,0,0,0,0,0,0,0,0,0,0,1,0,1,0,0,2,2,1,1,0,1,0,0
"A critical review on unmanned aerial vehicles power supply and energy management: Solutions, strategies, and prospects","Boukoberine, Mohamed Nadir; Zhou, Zhibin; Benbouzid, Mohamed",,,,APPLIED ENERGY,DEC 1 2019,2019,255,,,,,,,113823,10.1016/j.apenergy.2019.113823,,,8,4,0,0,0,0,0,0,0,0,0,0,0,0,0,0,0,0,0,0,0,0,0,0,0,0,0,0,0,0,0,0,0,0,0,0,0,0,0,0,0,0,0,0,0,0,0,0,0,0,0,0,0,0,0,0,0,0,0,0,0,0,0,0,0,0,0,0,0,0,0,0,0,0,0,0,0,0,0,0,0,0,0,0,0,0,0,0,0,0,0,0,0,0,0,0,0,0,0,0,0,0,0,0,0,0,0,0,0,0,0,0,0,0,0,0,0,0,0,0,0,0,8,0
"Evidence of the migratory bat, Pipistrellus nathusii, aggregating to the coastlines in the Northern Baltic Sea","Ijas, Asko; Kahilainen, Aapo; Vasko, Ville V.; Lilley, Thomas M.",,,,ACTA CHIROPTEROLOGICA,JUN 2017,2017,19,1,,,,127,139,,10.3161/15081109ACC2017.19.1.010,,,8,2,0,0,0,0,0,0,0,0,0,0,0,0,0,0,0,0,0,0,0,0,0,0,0,0,0,0,0,0,0,0,0,0,0,0,0,0,0,0,0,0,0,0,0,0,0,0,0,0,0,0,0,0,0,0,0,0,0,0,0,0,0,0,0,0,0,0,0,0,0,0,0,0,0,0,0,0,0,0,0,0,0,0,0,0,0,0,0,0,0,0,0,0,0,0,0,0,0,0,0,0,0,0,0,0,0,0,0,0,0,0,0,0,0,0,0,0,0,1,3,2,2,0
Characterization and pathogenicity of a novel mammalian orthoreovirus from wild short-nosed fruit bats,"Li, Zhijie; Liu, Dafei; Ran, Xuhua; Liu, Chunguo; Guo, Dongchun; Hu, Xiaoliang; Tian, Jin; Zhang, Xiaozhan; Shao, Yuhao; Liu, Shengwang; Qu, Liandong",,,,INFECTION GENETICS AND EVOLUTION,SEP 2016,2016,43,,,,,347,353,,10.1016/j.meegid.2016.05.039,,,8,1.6,0,0,0,0,0,0,0,0,0,0,0,0,0,0,0,0,0,0,0,0,0,0,0,0,0,0,0,0,0,0,0,0,0,0,0,0,0,0,0,0,0,0,0,0,0,0,0,0,0,0,0,0,0,0,0,0,0,0,0,0,0,0,0,0,0,0,0,0,0,0,0,0,0,0,0,0,0,0,0,0,0,0,0,0,0,0,0,0,0,0,0,0,0,0,0,0,0,0,0,0,0,0,0,0,0,0,0,0,0,0,0,0,0,0,0,0,0,2,2,2,2,0
A further cost for the sicker sex? Evidence for male-biased parasite-induced vulnerability to predation,"Stephenson, Jessica F.; Kinsella, Cormac; Cable, Joanne; van Oosterhout, Cock",,,,ECOLOGY AND EVOLUTION,APR 2016,2016,6,8,,,,2506,2515,,10.1002/ece3.2049,,,8,1.6,0,0,0,0,0,0,0,0,0,0,0,0,0,0,0,0,0,0,0,0,0,0,0,0,0,0,0,0,0,0,0,0,0,0,0,0,0,0,0,0,0,0,0,0,0,0,0,0,0,0,0,0,0,0,0,0,0,0,0,0,0,0,0,0,0,0,0,0,0,0,0,0,0,0,0,0,0,0,0,0,0,0,0,0,0,0,0,0,0,0,0,0,0,0,0,0,0,0,0,0,0,0,0,0,0,0,0,0,0,0,0,0,0,0,0,0,1,1,1,4,1,0
A Case Study of Urban and Peri-urban Mammal Communities: Implications for the Management of National Park Service Areas,"Chupp, Adam D.; Roder, Amy M.; Battaglia, Loretta L.; Pagels, John F.",,,,NORTHEASTERN NATURALIST,DEC 2013,2013,20,4,,,,631,654,,10.1656/045.020.0415,,,8,1,0,0,0,0,0,0,0,0,0,0,0,0,0,0,0,0,0,0,0,0,0,0,0,0,0,0,0,0,0,0,0,0,0,0,0,0,0,0,0,0,0,0,0,0,0,0,0,0,0,0,0,0,0,0,0,0,0,0,0,0,0,0,0,0,0,0,0,0,0,0,0,0,0,0,0,0,0,0,0,0,0,0,0,0,0,0,0,0,0,0,0,0,0,0,0,0,0,0,0,0,0,0,0,0,0,0,0,0,0,0,0,0,0,0,0,0,0,1,3,4,0,0
Novel management to enhance spider biodiversity in existing grass buffer strips,"Blake, Robin J.; Woodcock, Ben A.; Westbury, Duncan B.; Sutton, Peter; Potts, Simon G.",,,,AGRICULTURAL AND FOREST ENTOMOLOGY,FEB 2013,2013,15,1,,,,77,85,,10.1111/j.1461-9563.2012.00593.x,,,8,1,0,0,0,0,0,0,0,0,0,0,0,0,0,0,0,0,0,0,0,0,0,0,0,0,0,0,0,0,0,0,0,0,0,0,0,0,0,0,0,0,0,0,0,0,0,0,0,0,0,0,0,0,0,0,0,0,0,0,0,0,0,0,0,0,0,0,0,0,0,0,0,0,0,0,0,0,0,0,0,0,0,0,0,0,0,0,0,0,0,0,0,0,0,0,0,0,0,0,0,0,0,0,0,0,0,0,0,0,0,0,0,0,0,1,1,0,0,0,3,1,2,0
"Snowcover and melt characteristics of upland/lowland terrain: Polar Bear Pass, Bathurst Island, Nunavut, Canada","Young, Kathy L.; Assini, Jane; Abnizova, Anna; Miller, Elizabeth A.",,,,HYDROLOGY RESEARCH,2013,2013,44,1,,,,2,20,,10.2166/nh.2012.083,,,8,1,0,0,0,0,0,0,0,0,0,0,0,0,0,0,0,0,0,0,0,0,0,0,0,0,0,0,0,0,0,0,0,0,0,0,0,0,0,0,0,0,0,0,0,0,0,0,0,0,0,0,0,0,0,0,0,0,0,0,0,0,0,0,0,0,0,0,0,0,0,0,0,0,0,0,0,0,0,0,0,0,0,0,0,0,0,0,0,0,0,0,0,0,0,0,0,0,0,0,0,0,0,0,0,0,0,0,0,0,0,0,0,0,0,2,0,1,2,1,1,1,0,0
"Small Mammals from Kuala Atok, Taman Negara Pahang, Malaysia","Tingga, Roberta Chaya Tawie; Anwarali, F. A.; Ridwan, A. R. Mohd; Senawi, J.; Abdullah, M. T.",,,,SAINS MALAYSIANA,JUN 2012,2012,41,6,,,,659,669,,,,,8,0.89,0,0,0,0,0,0,0,0,0,0,0,0,0,0,0,0,0,0,0,0,0,0,0,0,0,0,0,0,0,0,0,0,0,0,0,0,0,0,0,0,0,0,0,0,0,0,0,0,0,0,0,0,0,0,0,0,0,0,0,0,0,0,0,0,0,0,0,0,0,0,0,0,0,0,0,0,0,0,0,0,0,0,0,0,0,0,0,0,0,0,0,0,0,0,0,0,0,0,0,0,0,0,0,0,0,0,0,0,0,0,0,0,0,1,2,1,1,1,0,1,1,0
"Mammals of Cabo Blanco: History, diversity, and conservation after 45 years of regrowth of a Costa Rican dry forest","Timm, Robert M.; Lieberman, Diana; Lieberman, Milton; McClearn, Deedra",,,,FOREST ECOLOGY AND MANAGEMENT,SEP 5 2009,2009,258,6,,,SI,997,1013,,10.1016/j.foreco.2008.10.027,,,8,0.67,0,0,0,0,0,0,0,0,0,0,0,0,0,0,0,0,0,0,0,0,0,0,0,0,0,0,0,0,0,0,0,0,0,0,0,0,0,0,0,0,0,0,0,0,0,0,0,0,0,0,0,0,0,0,0,0,0,0,0,0,0,0,0,0,0,0,0,0,0,0,0,0,0,0,0,0,0,0,0,0,0,0,0,0,0,0,0,0,0,0,0,0,0,0,0,0,0,0,0,0,0,0,0,0,0,0,0,0,0,0,0,1,0,0,1,1,4,0,0,1,0,0
Data sampling options for animal-borne video cameras: Considerations based on deployments with Antarctic fur seals,"Hooker, Sascha K.; Heaslip, Susan G.; Matthiopoulos, Jason; Cox, Oliver; Boyd, Ian L.",,,,MARINE TECHNOLOGY SOCIETY JOURNAL,SUM 2008,2008,42,2,,,,65,75,,10.4031/002533208786829179,,,8,0.62,0,0,0,0,0,0,0,0,0,0,0,0,0,0,0,0,0,0,0,0,0,0,0,0,0,0,0,0,0,0,0,0,0,0,0,0,0,0,0,0,0,0,0,0,0,0,0,0,0,0,0,0,0,0,0,0,0,0,0,0,0,0,0,0,0,0,0,0,0,0,0,0,0,0,0,0,0,0,0,0,0,0,0,0,0,0,0,0,0,0,0,0,0,0,0,0,0,0,0,0,0,0,0,0,0,0,0,0,0,1,1,1,1,0,0,1,2,0,0,0,1,0
Rabies surveillance in Poland (1992-2006),"Smreczak, M.; Trebas, P.; Ortowska, A.; Zmudzinski, J. F.",,,"Dodet, B; Fooks, AR; Miller, T; Tordo, N",TOWARDS THE ELIMINATION OF RABIES IN EURASIA,2008,2008,131,,,,,249,256,,,Joint OIE/WHO/EU International Conference on Towards te Elimination if Rabies in Eurasia,"MAY 27-30, 2007",8,0.62,0,0,0,0,0,0,0,0,0,0,0,0,0,0,0,0,0,0,0,0,0,0,0,0,0,0,0,0,0,0,0,0,0,0,0,0,0,0,0,0,0,0,0,0,0,0,0,0,0,0,0,0,0,0,0,0,0,0,0,0,0,0,0,0,0,0,0,0,0,0,0,0,0,0,0,0,0,0,0,0,0,0,0,0,0,0,0,0,0,0,0,0,0,0,0,0,0,0,0,0,0,0,0,0,0,0,0,0,0,1,0,1,2,0,0,0,1,0,0,2,1,0
Species richness and diversity of brackish and salt marshes in the Rio Grande delta,"Judd, FW; Lonard, RI",,,,JOURNAL OF COASTAL RESEARCH,FAL 2002,2002,18,4,,,,751,759,,,,,8,0.42,0,0,0,0,0,0,0,0,0,0,0,0,0,0,0,0,0,0,0,0,0,0,0,0,0,0,0,0,0,0,0,0,0,0,0,0,0,0,0,0,0,0,0,0,0,0,0,0,0,0,0,0,0,0,0,0,0,0,0,0,0,0,0,0,0,0,0,0,0,0,0,0,0,0,0,0,0,0,0,0,0,0,0,0,0,0,0,0,0,0,0,0,0,0,0,0,0,0,0,0,0,0,0,0,1,1,0,0,0,0,1,0,0,3,1,1,0,0,0,0,0,0
European Union's Last Intact Forest Landscapes are at A Value Chain Crossroad between Multiple Use and Intensified Wood Production,"Jonsson, Bengt Gunnar; Svensson, Johan; Mikusinski, Grzegorz; Manton, Michael; Angelstam, Per",,,,FORESTS,JUL 2019,2019,10,7,,,,,,564,10.3390/f10070564,,,7,3.5,0,0,0,0,0,0,0,0,0,0,0,0,0,0,0,0,0,0,0,0,0,0,0,0,0,0,0,0,0,0,0,0,0,0,0,0,0,0,0,0,0,0,0,0,0,0,0,0,0,0,0,0,0,0,0,0,0,0,0,0,0,0,0,0,0,0,0,0,0,0,0,0,0,0,0,0,0,0,0,0,0,0,0,0,0,0,0,0,0,0,0,0,0,0,0,0,0,0,0,0,0,0,0,0,0,0,0,0,0,0,0,0,0,0,0,0,0,0,0,1,6,0
Phylogeny matters: revisiting 'a comparison of bats and rodents as reservoirs of zoonotic viruses',"Guy, Cylita; Thiagavel, Jeneni; Mideo, Nicole; Ratcliffe, John M.",,,,ROYAL SOCIETY OPEN SCIENCE,FEB 2019,2019,6,2,,,,,,181182,10.1098/rsos.181182,,,7,3.5,0,0,0,0,0,0,0,0,0,0,0,0,0,0,0,0,0,0,0,0,0,0,0,0,0,0,0,0,0,0,0,0,0,0,0,0,0,0,0,0,0,0,0,0,0,0,0,0,0,0,0,0,0,0,0,0,0,0,0,0,0,0,0,0,0,0,0,0,0,0,0,0,0,0,0,0,0,0,0,0,0,0,0,0,0,0,0,0,0,0,0,0,0,0,0,0,0,0,0,0,0,0,0,0,0,0,0,0,0,0,0,0,0,0,0,0,0,0,0,2,5,0
"Circulation of Alphacoronavirus, Betacoronavirus and Paramyxovirus in Hipposideros bat species in Zimbabwe","Bourgarel, Mathieu; Pfukenyi, Davies M.; Boue, Vanina; Talignani, Loic; Chiweshe, Ngoni; Diop, Fode; Caron, Alexandre; Matope, Gift; Misse, Dorothee; Liegeois, Florian",,,,INFECTION GENETICS AND EVOLUTION,MAR 2018,2018,58,,,,,253,257,,10.1016/j.meegid.2018.01.007,,,7,2.33,0,0,0,0,0,0,0,0,0,0,0,0,0,0,0,0,0,0,0,0,0,0,0,0,0,0,0,0,0,0,0,0,0,0,0,0,0,0,0,0,0,0,0,0,0,0,0,0,0,0,0,0,0,0,0,0,0,0,0,0,0,0,0,0,0,0,0,0,0,0,0,0,0,0,0,0,0,0,0,0,0,0,0,0,0,0,0,0,0,0,0,0,0,0,0,0,0,0,0,0,0,0,0,0,0,0,0,0,0,0,0,0,0,0,0,0,0,0,0,3,4,0
The Motus Wildlife Tracking System: a collaborative research network to enhance the understanding of wildlife movement,"Taylor, Philip D.; Crewe, Tara L.; Mackenzie, Stuart A.; Lepage, Denis; Aubry, Yves; Crysler, Zoe; Finney, George; Francis, Charles M.; Guglielmo, Christopher G.; Hamilton, Diana J.; Holberton, Rebecca L.; Loring, Pamela H.; Mitchell, Greg W.; Norris, D. Ryan; Paquet, Julie; Ronconi, Robert A.; Smetzer, Jennifer R.; Smith, Paul A.; Welch, Linda J.; Woodworth, Bradley K.",,,,AVIAN CONSERVATION AND ECOLOGY,JUN 2017,2017,12,1,,,,,,8,10.5751/ACE-00953-120108,,,7,1.75,0,0,0,0,0,0,0,0,0,0,0,0,0,0,0,0,0,0,0,0,0,0,0,0,0,0,0,0,0,0,0,0,0,0,0,0,0,0,0,0,0,0,0,0,0,0,0,0,0,0,0,0,0,0,0,0,0,0,0,0,0,0,0,0,0,0,0,0,0,0,0,0,0,0,0,0,0,0,0,0,0,0,0,0,0,0,0,0,0,0,0,0,0,0,0,0,0,0,0,0,0,0,0,0,0,0,0,0,0,0,0,0,0,0,0,0,0,3,3,0,1,0
Searcher Efficiency and Survey Coverage Affect Precision of Fatality Estimates,"Reyes, Gabriel A.; Rodriguez, Meredith J.; Lindke, Kenneth T.; Ayres, Katherine L.; Halterman, Murrelet D.; Boroski, Brian B.; Johnston, Dave S.",,,,JOURNAL OF WILDLIFE MANAGEMENT,NOV 2016,2016,80,8,,,,1488,1496,,10.1002/jwmg.21126,,,7,1.4,0,0,0,0,0,0,0,0,0,0,0,0,0,0,0,0,0,0,0,0,0,0,0,0,0,0,0,0,0,0,0,0,0,0,0,0,0,0,0,0,0,0,0,0,0,0,0,0,0,0,0,0,0,0,0,0,0,0,0,0,0,0,0,0,0,0,0,0,0,0,0,0,0,0,0,0,0,0,0,0,0,0,0,0,0,0,0,0,0,0,0,0,0,0,0,0,0,0,0,0,0,0,0,0,0,0,0,0,0,0,0,0,0,0,0,0,0,1,2,0,4,0
Immobilization on magnetic nanoparticles of the recombinant trehalose synthase from Deinococcus geothermalis,"Panek, Anna; Pietrow, Olga; Synowiecki, Jozef; Filipkowski, Pawel",,,,FOOD AND BIOPRODUCTS PROCESSING,OCT 2013,2013,91,C4,,,,632,637,,10.1016/j.fbp.2013.04.007,,,7,0.88,0,0,0,0,0,0,0,0,0,0,0,0,0,0,0,0,0,0,0,0,0,0,0,0,0,0,0,0,0,0,0,0,0,0,0,0,0,0,0,0,0,0,0,0,0,0,0,0,0,0,0,0,0,0,0,0,0,0,0,0,0,0,0,0,0,0,0,0,0,0,0,0,0,0,0,0,0,0,0,0,0,0,0,0,0,0,0,0,0,0,0,0,0,0,0,0,0,0,0,0,0,0,0,0,0,0,0,0,0,0,0,0,0,0,1,0,1,1,2,1,1,0
"Seasonal differences in foraging dynamics, habitat use and home range size of Wahlberg's epauletted fruit bat in an urban environment","Rollinson, Dominic P.; Coleman, Joy C.; Downs, Colleen T.",,,,AFRICAN ZOOLOGY,OCT 2013,2013,48,2,,,,340,350,,10.3377/004.048.0218,,,7,0.88,0,0,0,0,0,0,0,0,0,0,0,0,0,0,0,0,0,0,0,0,0,0,0,0,0,0,0,0,0,0,0,0,0,0,0,0,0,0,0,0,0,0,0,0,0,0,0,0,0,0,0,0,0,0,0,0,0,0,0,0,0,0,0,0,0,0,0,0,0,0,0,0,0,0,0,0,0,0,0,0,0,0,0,0,0,0,0,0,0,0,0,0,0,0,0,0,0,0,0,0,0,0,0,0,0,0,0,0,0,0,0,0,0,0,1,2,1,0,1,1,1,0
Molecular characterisation of the national collection of Swiss cherry cultivars,"Frei, Andrea; Szalatnay, David; Zollinger, Tulipan; Frey, Juerg E.",,,,JOURNAL OF HORTICULTURAL SCIENCE & BIOTECHNOLOGY,JUL 2010,2010,85,4,,,,277,282,,10.1080/14620316.2010.11512668,,,7,0.64,0,0,0,0,0,0,0,0,0,0,0,0,0,0,0,0,0,0,0,0,0,0,0,0,0,0,0,0,0,0,0,0,0,0,0,0,0,0,0,0,0,0,0,0,0,0,0,0,0,0,0,0,0,0,0,0,0,0,0,0,0,0,0,0,0,0,0,0,0,0,0,0,0,0,0,0,0,0,0,0,0,0,0,0,0,0,0,0,0,0,0,0,0,0,0,0,0,0,0,0,0,0,0,0,0,0,0,0,0,0,1,0,1,1,0,1,0,1,1,1,0,0
"Control of Neobenedenia melleni (MacCallum, 1927) (Monogenea: Capsalidae) in dusky grouper, Epinephelus marginatus (Lowe, 1834), reared in floating net cages","Sanches, Eduardo Gomes",,,,REVISTA BRASILEIRA DE PARASITOLOGIA VETERINARIA,JUL-SEP 2008,2008,17,3,,,,145,149,,10.1590/S1984-29612008000300005,,,7,0.54,0,0,0,0,0,0,0,0,0,0,0,0,0,0,0,0,0,0,0,0,0,0,0,0,0,0,0,0,0,0,0,0,0,0,0,0,0,0,0,0,0,0,0,0,0,0,0,0,0,0,0,0,0,0,0,0,0,0,0,0,0,0,0,0,0,0,0,0,0,0,0,0,0,0,0,0,0,0,0,0,0,0,0,0,0,0,0,0,0,0,0,0,0,0,0,0,0,0,0,0,0,0,0,0,0,0,0,0,0,1,0,1,1,1,1,0,0,2,0,0,0,0
