Title,Authors,Corporate Authors,Editors,Book Editors,Source Title,Publication Date,Publication Year,Volume,Issue,Part Number,Supplement,Special Issue,Beginning Page,Ending Page,Article Number,DOI,Conference Title,Conference Date,Total Citations,Average per Year,1900,1901,1902,1903,1904,1905,1906,1907,1908,1909,1910,1911,1912,1913,1914,1915,1916,1917,1918,1919,1920,1921,1922,1923,1924,1925,1926,1927,1928,1929,1930,1931,1932,1933,1934,1935,1936,1937,1938,1939,1940,1941,1942,1943,1944,1945,1946,1947,1948,1949,1950,1951,1952,1953,1954,1955,1956,1957,1958,1959,1960,1961,1962,1963,1964,1965,1966,1967,1968,1969,1970,1971,1972,1973,1974,1975,1976,1977,1978,1979,1980,1981,1982,1983,1984,1985,1986,1987,1988,1989,1990,1991,1992,1993,1994,1995,1996,1997,1998,1999,2000,2001,2002,2003,2004,2005,2006,2007,2008,2009,2010,2011,2012,2013,2014,2015,2016,2017,2018,2019,2020,2021
Severe acute respiratory syndrome coronavirus-like virus in Chinese horseshoe bats,"Lau, SKP; Woo, PCY; Li, KSM; Huang, Y; Tsoi, HW; Wong, BHL; Wong, SSY; Leung, SY; Chan, KH; Yuen, KY",,,,PROCEEDINGS OF THE NATIONAL ACADEMY OF SCIENCES OF THE UNITED STATES OF AMERICA,SEP 27 2005,2005,102,39,,,,14040,14045,,10.1073/pnas.0506735102,,,732,45.75,0,0,0,0,0,0,0,0,0,0,0,0,0,0,0,0,0,0,0,0,0,0,0,0,0,0,0,0,0,0,0,0,0,0,0,0,0,0,0,0,0,0,0,0,0,0,0,0,0,0,0,0,0,0,0,0,0,0,0,0,0,0,0,0,0,0,0,0,0,0,0,0,0,0,0,0,0,0,0,0,0,0,0,0,0,0,0,0,0,0,0,0,0,0,0,0,0,0,0,0,0,0,0,0,0,6,63,68,61,46,45,36,40,50,50,37,41,34,31,36,88,0
Carbon Nanosheet Frameworks Derived from Peat Moss as High Performance Sodium Ion Battery Anodes,"Ding, Jia; Wang, Huanlei; Li, Zhi; Kohandehghan, Alireza; Cui, Kai; Xu, Zhanwei; Zahiri, Beniamin; Tan, Xuehai; Lotfabad, Elmira Memarzadeh; Olsen, Brian C.; Mitlin, David",,,,ACS NANO,DEC 2013,2013,7,12,,,,11004,11015,,10.1021/nn404640c,,,570,71.25,0,0,0,0,0,0,0,0,0,0,0,0,0,0,0,0,0,0,0,0,0,0,0,0,0,0,0,0,0,0,0,0,0,0,0,0,0,0,0,0,0,0,0,0,0,0,0,0,0,0,0,0,0,0,0,0,0,0,0,0,0,0,0,0,0,0,0,0,0,0,0,0,0,0,0,0,0,0,0,0,0,0,0,0,0,0,0,0,0,0,0,0,0,0,0,0,0,0,0,0,0,0,0,0,0,0,0,0,0,0,0,0,0,0,21,70,84,97,113,116,69,0
Isolation and characterization of a bat SARS-like coronavirus that uses the ACE2 receptor,"Ge, Xing-Yi; Li, Jia-Lu; Yang, Xing-Lou; Chmura, Aleksei A.; Zhu, Guangjian; Epstein, Jonathan H.; Mazet, Jonna K.; Hu, Ben; Zhang, Wei; Peng, Cheng; Zhang, Yu-Ji; Luo, Chu-Ming; Tan, Bing; Wang, Ning; Zhu, Yan; Crameri, Gary; Zhang, Shu-Yi; Wang, Lin-Fa; Daszak, Peter; Shi, Zheng-Li",,,,NATURE,NOV 28 2013,2013,503,7477,,,,535,+,,10.1038/nature12711,,,471,58.88,0,0,0,0,0,0,0,0,0,0,0,0,0,0,0,0,0,0,0,0,0,0,0,0,0,0,0,0,0,0,0,0,0,0,0,0,0,0,0,0,0,0,0,0,0,0,0,0,0,0,0,0,0,0,0,0,0,0,0,0,0,0,0,0,0,0,0,0,0,0,0,0,0,0,0,0,0,0,0,0,0,0,0,0,0,0,0,0,0,0,0,0,0,0,0,0,0,0,0,0,0,0,0,0,0,0,0,0,0,0,0,0,0,1,40,44,56,55,42,39,194,0
"Emerging coronaviruses: Genome structure, replication, and pathogenesis","Chen, Yu; Liu, Qianyun; Guo, Deyin",,,,JOURNAL OF MEDICAL VIROLOGY,APR 2020,2020,92,4,,,SI,418,423,,10.1002/jmv.25681,,,317,317,0,0,0,0,0,0,0,0,0,0,0,0,0,0,0,0,0,0,0,0,0,0,0,0,0,0,0,0,0,0,0,0,0,0,0,0,0,0,0,0,0,0,0,0,0,0,0,0,0,0,0,0,0,0,0,0,0,0,0,0,0,0,0,0,0,0,0,0,0,0,0,0,0,0,0,0,0,0,0,0,0,0,0,0,0,0,0,0,0,0,0,0,0,0,0,0,0,0,0,0,0,0,0,0,0,0,0,0,0,0,0,0,0,0,0,0,0,0,0,1,316,0
Advanced backcross QTL analysis in a cross between an elite processing line of tomato and its wild relative L-pimpinellifolium,"Tanksley, SD; Grandillo, S; Fulton, TM; Zamir, D; Eshed, Y; Petiard, V; Lopez, J; BeckBunn, T",,,,THEORETICAL AND APPLIED GENETICS,FEB 1996,1996,92,2,,,,213,224,,,,,292,11.68,0,0,0,0,0,0,0,0,0,0,0,0,0,0,0,0,0,0,0,0,0,0,0,0,0,0,0,0,0,0,0,0,0,0,0,0,0,0,0,0,0,0,0,0,0,0,0,0,0,0,0,0,0,0,0,0,0,0,0,0,0,0,0,0,0,0,0,0,0,0,0,0,0,0,0,0,0,0,0,0,0,0,0,0,0,0,0,0,0,0,0,0,0,0,0,0,3,8,13,12,10,14,15,18,22,15,13,15,13,13,7,17,9,13,10,11,8,12,6,9,6,0
Middle East Respiratory Syndrome Coronavirus: Another Zoonotic Betacoronavirus Causing SARS-Like Disease,"Chan, Jasper F. W.; Lau, Susanna K. P.; To, Kelvin K. W.; Cheng, Vincent C. C.; Woo, Patrick C. Y.; Yuen, Kwok-Yung",,,,CLINICAL MICROBIOLOGY REVIEWS,APR 2015,2015,28,2,,,,465,522,,10.1128/CMR.00102-14,,,264,44,0,0,0,0,0,0,0,0,0,0,0,0,0,0,0,0,0,0,0,0,0,0,0,0,0,0,0,0,0,0,0,0,0,0,0,0,0,0,0,0,0,0,0,0,0,0,0,0,0,0,0,0,0,0,0,0,0,0,0,0,0,0,0,0,0,0,0,0,0,0,0,0,0,0,0,0,0,0,0,0,0,0,0,0,0,0,0,0,0,0,0,0,0,0,0,0,0,0,0,0,0,0,0,0,0,0,0,0,0,0,0,0,0,0,0,20,46,21,23,40,114,0
Severe acute respiratory syndrome coronavirus as an agent of emerging and reemerging infection,"Cheng, Vincent C. C.; Lau, Susanna K. P.; Woo, Patrick C. Y.; Yuen, Kwok Yung",,,,CLINICAL MICROBIOLOGY REVIEWS,OCT 2007,2007,20,4,,,,660,+,,10.1128/CMR.00023-07,,,229,16.36,0,0,0,0,0,0,0,0,0,0,0,0,0,0,0,0,0,0,0,0,0,0,0,0,0,0,0,0,0,0,0,0,0,0,0,0,0,0,0,0,0,0,0,0,0,0,0,0,0,0,0,0,0,0,0,0,0,0,0,0,0,0,0,0,0,0,0,0,0,0,0,0,0,0,0,0,0,0,0,0,0,0,0,0,0,0,0,0,0,0,0,0,0,0,0,0,0,0,0,0,0,0,0,0,0,0,0,0,10,13,9,5,9,12,15,10,15,2,5,7,117,0
Identification of a novel coronavirus in bats,"Poon, LLM; Chu, DKW; Chan, KH; Wong, OK; Ellis, TM; Leung, YHC; Lau, SKP; Woo, PCY; Suen, KY; Yuen, KY; Guan, Y; Peiris, JSM",,,,JOURNAL OF VIROLOGY,FEB 2005,2005,79,4,,,,2001,2009,,10.1128/JVI.79.4.2001-2009.2005,,,204,12.75,0,0,0,0,0,0,0,0,0,0,0,0,0,0,0,0,0,0,0,0,0,0,0,0,0,0,0,0,0,0,0,0,0,0,0,0,0,0,0,0,0,0,0,0,0,0,0,0,0,0,0,0,0,0,0,0,0,0,0,0,0,0,0,0,0,0,0,0,0,0,0,0,0,0,0,0,0,0,0,0,0,0,0,0,0,0,0,0,0,0,0,0,0,0,0,0,0,0,0,0,0,0,0,0,0,4,28,20,26,11,12,15,9,14,8,11,11,9,7,5,15,0
The Feasibility of Canine Rabies Elimination in Africa: Dispelling Doubts with Data,"Lembo, Tiziana; Hampson, Katie; Kaare, Magai T.; Ernest, Eblate; Knobel, Darryn; Kazwala, Rudovick R.; Haydon, Daniel T.; Cleaveland, Sarah",,,,PLOS NEGLECTED TROPICAL DISEASES,FEB 2010,2010,4,2,,,,,,e626,10.1371/journal.pntd.0000626,,,195,17.73,0,0,0,0,0,0,0,0,0,0,0,0,0,0,0,0,0,0,0,0,0,0,0,0,0,0,0,0,0,0,0,0,0,0,0,0,0,0,0,0,0,0,0,0,0,0,0,0,0,0,0,0,0,0,0,0,0,0,0,0,0,0,0,0,0,0,0,0,0,0,0,0,0,0,0,0,0,0,0,0,0,0,0,0,0,0,0,0,0,0,0,0,0,0,0,0,0,0,0,0,0,0,0,0,0,0,0,0,0,0,8,3,16,20,19,23,11,31,24,19,21,0
Global Conservation Significance of Ecuador's Yasuni National Park,"Bass, Margot S.; Finer, Matt; Jenkins, Clinton N.; Kreft, Holger; Cisneros-Heredia, Diego F.; McCracken, Shawn F.; Pitman, Nigel C. A.; English, Peter H.; Swing, Kelly; Villa, Gorky; Di Fiore, Anthony; Voigt, Christian C.; Kunz, Thomas H.",,,,PLOS ONE,JAN 19 2010,2010,5,1,,,,,,e8767,10.1371/journal.pone.0008767,,,195,17.73,0,0,0,0,0,0,0,0,0,0,0,0,0,0,0,0,0,0,0,0,0,0,0,0,0,0,0,0,0,0,0,0,0,0,0,0,0,0,0,0,0,0,0,0,0,0,0,0,0,0,0,0,0,0,0,0,0,0,0,0,0,0,0,0,0,0,0,0,0,0,0,0,0,0,0,0,0,0,0,0,0,0,0,0,0,0,0,0,0,0,0,0,0,0,0,0,0,0,0,0,0,0,0,0,0,0,0,0,0,0,5,13,11,22,20,19,16,27,18,30,14,0
Binding and dissociation kinetics of wild-type and mutant streptavidins on mixed biotin-containing alkylthiolate monolayers,"Jung, LS; Nelson, KE; Stayton, PS; Campbell, CT",,,,LANGMUIR,NOV 28 2000,2000,16,24,,,,9421,9432,,10.1021/la000144r,,,192,9.14,0,0,0,0,0,0,0,0,0,0,0,0,0,0,0,0,0,0,0,0,0,0,0,0,0,0,0,0,0,0,0,0,0,0,0,0,0,0,0,0,0,0,0,0,0,0,0,0,0,0,0,0,0,0,0,0,0,0,0,0,0,0,0,0,0,0,0,0,0,0,0,0,0,0,0,0,0,0,0,0,0,0,0,0,0,0,0,0,0,0,0,0,0,0,0,0,0,0,0,0,0,2,8,10,17,12,8,13,16,18,15,5,16,12,7,7,4,10,9,2,1,0
Ecological dynamics of emerging bat virus spillover,"Plowright, Raina K.; Eby, Peggy; Hudson, Peter J.; Smith, Ina L.; Westcott, David; Bryden, Wayne L.; Middleton, Deborah; Reid, Peter A.; McFarlane, Rosemary A.; Martin, Gerardo; Tabor, Gary M.; Skerratt, Lee F.; Anderson, Dale L.; Crameri, Gary; Quammen, David; Jordan, David; Freeman, Paul; Wang, Lin-Fa; Epstein, Jonathan H.; Marsh, Glenn A.; Kung, Nina Y.; McCallum, Hamish",,,,PROCEEDINGS OF THE ROYAL SOCIETY B-BIOLOGICAL SCIENCES,JAN 7 2015,2015,282,1798,,,,,,20142124,10.1098/rspb.2014.2124,,,188,31.33,0,0,0,0,0,0,0,0,0,0,0,0,0,0,0,0,0,0,0,0,0,0,0,0,0,0,0,0,0,0,0,0,0,0,0,0,0,0,0,0,0,0,0,0,0,0,0,0,0,0,0,0,0,0,0,0,0,0,0,0,0,0,0,0,0,0,0,0,0,0,0,0,0,0,0,0,0,0,0,0,0,0,0,0,0,0,0,0,0,0,0,0,0,0,0,0,0,0,0,0,0,0,0,0,0,0,0,0,0,0,0,0,0,0,0,22,30,32,36,41,27,0
A SARS-like cluster of circulating bat coronaviruses shows potential for human emergence,"Menachery, Vineet D.; Yount, Boyd L., Jr.; Debbink, Kari; Agnihothram, Sudhakar; Gralinski, Lisa E.; Plante, Jessica A.; Graham, Rachel L.; Scobey, Trevor; Ge, Xing-Yi; Donaldson, Eric F.; Randell, Scott H.; Lanzavecchia, Antonio; Marasco, Wayne A.; Shi, Zhengli-Li; Baric, Ralph S.",,,,NATURE MEDICINE,DEC 2015,2015,21,12,,,,1508,+,,10.1038/nm.3985,,,187,31.17,0,0,0,0,0,0,0,0,0,0,0,0,0,0,0,0,0,0,0,0,0,0,0,0,0,0,0,0,0,0,0,0,0,0,0,0,0,0,0,0,0,0,0,0,0,0,0,0,0,0,0,0,0,0,0,0,0,0,0,0,0,0,0,0,0,0,0,0,0,0,0,0,0,0,0,0,0,0,0,0,0,0,0,0,0,0,0,0,0,0,0,0,0,0,0,0,0,0,0,0,0,0,0,0,0,0,0,0,0,0,0,0,0,0,0,0,23,26,18,17,103,0
Prevalence and genetic diversity of coronaviruses in bats from China,"Tang, X. C.; Zhang, J. X.; Zhang, S. Y.; Wang, P.; Fan, X. H.; Li, L. F.; Li, G.; Dong, B. Q.; Liu, W.; Cheung, C. L.; Xu, K. M.; Song, W. J.; Vijaykrishna, D.; Poon, L. L. M.; Peiris, J. S. M.; Smith, G. J. D.; Chen, H.; Guan, Y.",,,,JOURNAL OF VIROLOGY,AUG 2006,2006,80,15,,,,7481,7490,,10.1128/JVI.00697-06,,,186,12.4,0,0,0,0,0,0,0,0,0,0,0,0,0,0,0,0,0,0,0,0,0,0,0,0,0,0,0,0,0,0,0,0,0,0,0,0,0,0,0,0,0,0,0,0,0,0,0,0,0,0,0,0,0,0,0,0,0,0,0,0,0,0,0,0,0,0,0,0,0,0,0,0,0,0,0,0,0,0,0,0,0,0,0,0,0,0,0,0,0,0,0,0,0,0,0,0,0,0,0,0,0,0,0,0,0,0,3,12,17,14,19,13,8,13,10,15,10,11,11,13,17,0
Biodiversity and its conservation in the Sundarban Mangrove Ecosystem,"Gopal, Brij; Chauhan, Malavika",,,,AQUATIC SCIENCES,OCT 2006,2006,68,3,,,,338,354,,10.1007/s00027-006-0868-8,,,184,12.27,0,0,0,0,0,0,0,0,0,0,0,0,0,0,0,0,0,0,0,0,0,0,0,0,0,0,0,0,0,0,0,0,0,0,0,0,0,0,0,0,0,0,0,0,0,0,0,0,0,0,0,0,0,0,0,0,0,0,0,0,0,0,0,0,0,0,0,0,0,0,0,0,0,0,0,0,0,0,0,0,0,0,0,0,0,0,0,0,0,0,0,0,0,0,0,0,0,0,0,0,0,0,0,0,0,0,1,1,3,4,9,8,9,13,16,14,20,28,20,29,9,0
Cross-species transmission of the newly identified coronavirus 2019-nCoV,"Ji, Wei; Wang, Wei; Zhao, Xiaofang; Zai, Junjie; Li, Xingguang",,,,JOURNAL OF MEDICAL VIROLOGY,APR 2020,2020,92,4,,,SI,433,440,,10.1002/jmv.25682,,,163,163,0,0,0,0,0,0,0,0,0,0,0,0,0,0,0,0,0,0,0,0,0,0,0,0,0,0,0,0,0,0,0,0,0,0,0,0,0,0,0,0,0,0,0,0,0,0,0,0,0,0,0,0,0,0,0,0,0,0,0,0,0,0,0,0,0,0,0,0,0,0,0,0,0,0,0,0,0,0,0,0,0,0,0,0,0,0,0,0,0,0,0,0,0,0,0,0,0,0,0,0,0,0,0,0,0,0,0,0,0,0,0,0,0,0,0,0,0,0,0,1,162,0
Bats are a major natural reservoir for hepaciviruses and pegiviruses,"Quan, Phenix-Lan; Firth, Cadhla; Conte, Juliette M.; Williams, Simon H.; Zambrana-Torrelio, Carlos M.; Anthony, Simon J.; Ellison, James A.; Gilbert, Amy T.; Kuzmin, Ivan V.; Niezgoda, Michael; Osinubi, Modupe O. V.; Recuenco, Sergio; Markotter, Wanda; Breiman, Robert F.; Kalemba, Lems; Malekani, Jean; Lindblade, Kim A.; Rostal, Melinda K.; Ojeda-Flores, Rafael; Suzan, Gerardo; Davis, Lora B.; Blau, Dianna M.; Ogunkoya, Albert B.; Alvarez Castillo, Danilo A.; Moran, David; Ngam, Sali; Akaibe, Dudu; Agwanda, Bernard; Briese, Thomas; Epstein, Jonathan H.; Daszak, Peter; Rupprecht, Charles E.; Holmes, Edward C.; Lipkin, W. Ian",,,,PROCEEDINGS OF THE NATIONAL ACADEMY OF SCIENCES OF THE UNITED STATES OF AMERICA,MAY 14 2013,2013,110,20,,,,8194,8199,,10.1073/pnas.1303037110,,,153,19.13,0,0,0,0,0,0,0,0,0,0,0,0,0,0,0,0,0,0,0,0,0,0,0,0,0,0,0,0,0,0,0,0,0,0,0,0,0,0,0,0,0,0,0,0,0,0,0,0,0,0,0,0,0,0,0,0,0,0,0,0,0,0,0,0,0,0,0,0,0,0,0,0,0,0,0,0,0,0,0,0,0,0,0,0,0,0,0,0,0,0,0,0,0,0,0,0,0,0,0,0,0,0,0,0,0,0,0,0,0,0,0,0,0,11,27,31,19,18,19,15,13,0
Salmonella typhimurium apparently perceives external nitrogen limitation as internal glutamine limitation,"Ikeda, TP; Shauger, AE; Kustu, S",,,,JOURNAL OF MOLECULAR BIOLOGY,JUN 21 1996,1996,259,4,,,,589,607,,10.1006/jmbi.1996.0342,,,147,5.88,0,0,0,0,0,0,0,0,0,0,0,0,0,0,0,0,0,0,0,0,0,0,0,0,0,0,0,0,0,0,0,0,0,0,0,0,0,0,0,0,0,0,0,0,0,0,0,0,0,0,0,0,0,0,0,0,0,0,0,0,0,0,0,0,0,0,0,0,0,0,0,0,0,0,0,0,0,0,0,0,0,0,0,0,0,0,0,0,0,0,0,0,0,0,0,0,0,3,9,9,5,7,6,9,6,11,11,8,8,4,14,5,6,4,0,1,8,4,4,2,3,0
Fatal swine acute diarrhoea syndrome caused by an HKU2-related coronavirus of bat origin,"Zhou, Peng; Fan, Hang; Lan, Tian; Yang, Xing-Lou; Shi, Wei-Feng; Zhang, Wei; Zhu, Yan; Zhang, Ya-Wei; Xie, Qing-Mei; Mani, Shailendra; Zheng, Xiao-Shuang; Li, Bei; Li, Jin-Man; Guo, Hua; Pei, Guang-Qian; An, Xiao-Ping; Chen, Jun-Wei; Zhou, Ling; Mai, Kai-Jie; Wu, Zi-Xian; Li, Di; Anderson, Danielle E.; Zhang, Li-Biao; Li, Shi-Yue; Mi, Zhi-Qiang; He, Tong-Tong; Cong, Feng; Guo, Peng-Ju; Huang, Ren; Luo, Yun; Liu, Xiang-Ling; Chen, Jing; Huang, Yong; Sun, Qiang; Zhang, Xiang-Li-Lan; Wang, Yuan-Yuan; Xing, Shao-Zhen; Chen, Yan-Shan; Sun, Yuan; Li, Juan; Daszak, Peter; Wang, Lin-Fa; Shi, Zheng-Li; Tong, Yi-Gang; Ma, Jing-Yun",,,,NATURE,APR 12 2018,2018,556,7700,,,,255,+,,10.1038/s41586-018-0010-9,,,146,48.67,0,0,0,0,0,0,0,0,0,0,0,0,0,0,0,0,0,0,0,0,0,0,0,0,0,0,0,0,0,0,0,0,0,0,0,0,0,0,0,0,0,0,0,0,0,0,0,0,0,0,0,0,0,0,0,0,0,0,0,0,0,0,0,0,0,0,0,0,0,0,0,0,0,0,0,0,0,0,0,0,0,0,0,0,0,0,0,0,0,0,0,0,0,0,0,0,0,0,0,0,0,0,0,0,0,0,0,0,0,0,0,0,0,0,0,0,0,0,14,54,78,0
"Selection, evolution of behavior and animal models in behavioral neuroscience","Parmigiani, S; Palanza, P; Rodgers, J; Ferrari, PF",,,,NEUROSCIENCE AND BIOBEHAVIORAL REVIEWS,NOV 1999,1999,23,7,,,,957,970,,10.1016/S0149-7634(99)00029-9,Workshop on Ethology and Biomedical Science,"DEC 01-06, 1998",145,6.59,0,0,0,0,0,0,0,0,0,0,0,0,0,0,0,0,0,0,0,0,0,0,0,0,0,0,0,0,0,0,0,0,0,0,0,0,0,0,0,0,0,0,0,0,0,0,0,0,0,0,0,0,0,0,0,0,0,0,0,0,0,0,0,0,0,0,0,0,0,0,0,0,0,0,0,0,0,0,0,0,0,0,0,0,0,0,0,0,0,0,0,0,0,0,0,0,0,0,0,0,4,8,9,7,9,12,12,11,8,7,6,8,3,8,5,7,1,8,6,2,4,0
Sterol regulatory element-binding proteins induce an entire pathway of cholesterol synthesis,"Sakakura, Y; Shimano, H; Sone, H; Takahashi, A; Inoue, K; Toyoshima, H; Suzuki, S; Yamada, N",,,,BIOCHEMICAL AND BIOPHYSICAL RESEARCH COMMUNICATIONS,AUG 10 2001,2001,286,1,,,,176,183,,10.1006/bbrc.2001.5375,,,142,7.1,0,0,0,0,0,0,0,0,0,0,0,0,0,0,0,0,0,0,0,0,0,0,0,0,0,0,0,0,0,0,0,0,0,0,0,0,0,0,0,0,0,0,0,0,0,0,0,0,0,0,0,0,0,0,0,0,0,0,0,0,0,0,0,0,0,0,0,0,0,0,0,0,0,0,0,0,0,0,0,0,0,0,0,0,0,0,0,0,0,0,0,0,0,0,0,0,0,0,0,0,0,1,10,9,9,13,5,8,4,8,4,7,9,5,6,6,7,9,3,12,7,0
Genealogy profiling through strain improvement by using metabolic network analysis: Metabolic flux genealogy of several generations of lysine-producing corynebacteria,"Wittmann, C; Heinzle, E",,,,APPLIED AND ENVIRONMENTAL MICROBIOLOGY,DEC 2002,2002,68,12,,,,5843,5859,,10.1128/AEM.68.12.5843-5859.2002,,,141,7.42,0,0,0,0,0,0,0,0,0,0,0,0,0,0,0,0,0,0,0,0,0,0,0,0,0,0,0,0,0,0,0,0,0,0,0,0,0,0,0,0,0,0,0,0,0,0,0,0,0,0,0,0,0,0,0,0,0,0,0,0,0,0,0,0,0,0,0,0,0,0,0,0,0,0,0,0,0,0,0,0,0,0,0,0,0,0,0,0,0,0,0,0,0,0,0,0,0,0,0,0,0,0,0,4,11,15,11,11,7,9,9,13,10,11,5,7,3,2,8,3,2,0
Identifying SARS-CoV-2-related coronaviruses in Malayan pangolins,"Lam, Tommy Tsan-Yuk; Jia, Na; Zhang, Ya-Wei; Shum, Marcus Ho-Hin; Jiang, Jia-Fu; Zhu, Hua-Chen; Tong, Yi-Gang; Shi, Yong-Xia; Ni, Xue-Bing; Liao, Yun-Shi; Li, Wen-Juan; Jiang, Bao-Gui; Wei, Wei; Yuan, Ting-Ting; Zheng, Kui; Cui, Xiao-Ming; Li, Jie; Pei, Guang-Qian; Qiang, Xin; Cheung, William Yiu-Man; Li, Lian-Feng; Sun, Fang-Fang; Qin, Si; Huang, Ji-Cheng; Leung, Gabriel M.; Holmes, Edward C.; Hu, Yan-Ling; Guan, Yi; Cao, Wu-Chun",,,,NATURE,JUL 9 2020,2020,583,7815,,,,282,+,,10.1038/s41586-020-2169-0,,,138,138,0,0,0,0,0,0,0,0,0,0,0,0,0,0,0,0,0,0,0,0,0,0,0,0,0,0,0,0,0,0,0,0,0,0,0,0,0,0,0,0,0,0,0,0,0,0,0,0,0,0,0,0,0,0,0,0,0,0,0,0,0,0,0,0,0,0,0,0,0,0,0,0,0,0,0,0,0,0,0,0,0,0,0,0,0,0,0,0,0,0,0,0,0,0,0,0,0,0,0,0,0,0,0,0,0,0,0,0,0,0,0,0,0,0,0,0,0,0,0,0,138,0
Identifying SARS-CoV-2-related coronaviruses in Malayan pangolins,"Lam, Tommy Tsan-Yuk; Jia, Na; Zhang, Ya-Wei; Shum, Marcus Ho-Hin; Jiang, Jia-Fu; Zhu, Hua-Chen; Tong, Yi-Gang; Shi, Yong-Xia; Ni, Xue-Bing; Liao, Yun-Shi; Li, Wen-Juan; Jiang, Bao-Gui; Wei, Wei; Yuan, Ting-Ting; Zheng, Kui; Cui, Xiao-Ming; Li, Jie; Pei, Guang-Qian; Qiang, Xin; Cheung, William Yiu-Man; Li, Lian-Feng; Sun, Fang-Fang; Qin, Si; Huang, Ji-Cheng; Leung, Gabriel M.; Holmes, Edward C.; Hu, Yan-Ling; Guan, Yi; Cao, Wu-Chun",,,,NATURE,JUL 9 2020,2020,583,7815,,,,282,+,,10.1038/s41586-020-2169-0,,,138,138,0,0,0,0,0,0,0,0,0,0,0,0,0,0,0,0,0,0,0,0,0,0,0,0,0,0,0,0,0,0,0,0,0,0,0,0,0,0,0,0,0,0,0,0,0,0,0,0,0,0,0,0,0,0,0,0,0,0,0,0,0,0,0,0,0,0,0,0,0,0,0,0,0,0,0,0,0,0,0,0,0,0,0,0,0,0,0,0,0,0,0,0,0,0,0,0,0,0,0,0,0,0,0,0,0,0,0,0,0,0,0,0,0,0,0,0,0,0,0,0,138,0
Evolutionary insights into the ecology of coronaviruses,"Vijaykrishna, D.; Smith, G. J. D.; Zhang, J. X.; Peiris, J. S. M.; Chen, H.; Guan, Y.",,,,JOURNAL OF VIROLOGY,APR 2007,2007,81,8,,,,4012,4020,,10.1128/JVI.02605-06,,,132,9.43,0,0,0,0,0,0,0,0,0,0,0,0,0,0,0,0,0,0,0,0,0,0,0,0,0,0,0,0,0,0,0,0,0,0,0,0,0,0,0,0,0,0,0,0,0,0,0,0,0,0,0,0,0,0,0,0,0,0,0,0,0,0,0,0,0,0,0,0,0,0,0,0,0,0,0,0,0,0,0,0,0,0,0,0,0,0,0,0,0,0,0,0,0,0,0,0,0,0,0,0,0,0,0,0,0,0,0,4,12,15,14,12,9,11,9,6,10,8,6,4,12,0
Comparative Analysis of Complete Genome Sequences of Three Avian Coronaviruses Reveals a Novel Group 3c Coronavirus,"Woo, Patrick C. Y.; Lau, Susanna K. P.; Lam, Carol S. F.; Lai, Kenneth K. Y.; Huang, Yi; Lee, Paul; Luk, Geraldine S. M.; Dyrting, Kitman C.; Chan, Kwok-Hung; Yuen, Kwok-Yung",,,,JOURNAL OF VIROLOGY,JAN 15 2009,2009,83,2,,,,908,917,,10.1128/JVI.01977-08,,,128,10.67,0,0,0,0,0,0,0,0,0,0,0,0,0,0,0,0,0,0,0,0,0,0,0,0,0,0,0,0,0,0,0,0,0,0,0,0,0,0,0,0,0,0,0,0,0,0,0,0,0,0,0,0,0,0,0,0,0,0,0,0,0,0,0,0,0,0,0,0,0,0,0,0,0,0,0,0,0,0,0,0,0,0,0,0,0,0,0,0,0,0,0,0,0,0,0,0,0,0,0,0,0,0,0,0,0,0,0,0,0,11,16,12,11,8,10,14,14,7,4,8,13,0
Interspecies transmission and emergence of novel viruses: lessons from bats and birds,"Chan, Jasper Fuk-Woo; To, Kelvin Kai-Wang; Tse, Herman; Jin, Dong-Yan; Yuen, Kwok-Yung",,,,TRENDS IN MICROBIOLOGY,OCT 2013,2013,21,10,,,,544,555,,10.1016/j.tim.2013.05.005,,,126,15.75,0,0,0,0,0,0,0,0,0,0,0,0,0,0,0,0,0,0,0,0,0,0,0,0,0,0,0,0,0,0,0,0,0,0,0,0,0,0,0,0,0,0,0,0,0,0,0,0,0,0,0,0,0,0,0,0,0,0,0,0,0,0,0,0,0,0,0,0,0,0,0,0,0,0,0,0,0,0,0,0,0,0,0,0,0,0,0,0,0,0,0,0,0,0,0,0,0,0,0,0,0,0,0,0,0,0,0,0,0,0,0,0,0,4,16,19,19,12,14,11,31,0
Selection of roosting and foraging habitat by bats in different-aged aspen mixedwood stands,"Crampton, LH; Barclay, RMR",,,,CONSERVATION BIOLOGY,DEC 1998,1998,12,6,,,,1347,1358,,10.1046/j.1523-1739.1998.97209.x,,,123,5.35,0,0,0,0,0,0,0,0,0,0,0,0,0,0,0,0,0,0,0,0,0,0,0,0,0,0,0,0,0,0,0,0,0,0,0,0,0,0,0,0,0,0,0,0,0,0,0,0,0,0,0,0,0,0,0,0,0,0,0,0,0,0,0,0,0,0,0,0,0,0,0,0,0,0,0,0,0,0,0,0,0,0,0,0,0,0,0,0,0,0,0,0,0,0,0,0,0,0,0,0,5,5,7,7,3,4,10,6,7,10,7,10,4,8,3,6,6,4,2,5,4,0
A domain contributing to the ion channel of ATP-gated P2X(2) receptors identified by the substituted cysteine accessibility method,"Egan, TM; Haines, WR; Voigt, MM",,,,JOURNAL OF NEUROSCIENCE,APR 1 1998,1998,18,7,,,,2350,2359,,,,,123,5.35,0,0,0,0,0,0,0,0,0,0,0,0,0,0,0,0,0,0,0,0,0,0,0,0,0,0,0,0,0,0,0,0,0,0,0,0,0,0,0,0,0,0,0,0,0,0,0,0,0,0,0,0,0,0,0,0,0,0,0,0,0,0,0,0,0,0,0,0,0,0,0,0,0,0,0,0,0,0,0,0,0,0,0,0,0,0,0,0,0,0,0,0,0,0,0,0,0,0,5,11,5,8,6,4,13,9,5,3,7,10,6,7,4,1,9,4,3,0,0,0,3,0
The pathogen Batrachochytrium dendrobatidis disturbs the frog skin microbiome during a natural epidemic and experimental infection,"Jani, Andrea J.; Briggs, Cheryl J.",,,,PROCEEDINGS OF THE NATIONAL ACADEMY OF SCIENCES OF THE UNITED STATES OF AMERICA,NOV 25 2014,2014,111,47,,,,E5049,E5058,,10.1073/pnas.1412752111,,,109,15.57,0,0,0,0,0,0,0,0,0,0,0,0,0,0,0,0,0,0,0,0,0,0,0,0,0,0,0,0,0,0,0,0,0,0,0,0,0,0,0,0,0,0,0,0,0,0,0,0,0,0,0,0,0,0,0,0,0,0,0,0,0,0,0,0,0,0,0,0,0,0,0,0,0,0,0,0,0,0,0,0,0,0,0,0,0,0,0,0,0,0,0,0,0,0,0,0,0,0,0,0,0,0,0,0,0,0,0,0,0,0,0,0,0,0,0,7,13,25,25,26,13,0
Structural characterization and immunogenicity in wild-type and immune tolerant mice of degraded recombinant human interferon alpha2b,"Hermeling, S; Aranha, L; Damen, JMA; Slijper, M; Schellekens, H; Crommelin, DJA; Jiskoot, W",,,,PHARMACEUTICAL RESEARCH,DEC 2005,2005,22,12,,,,1997,2006,,10.1007/s11095-005-8177-9,,,106,6.63,0,0,0,0,0,0,0,0,0,0,0,0,0,0,0,0,0,0,0,0,0,0,0,0,0,0,0,0,0,0,0,0,0,0,0,0,0,0,0,0,0,0,0,0,0,0,0,0,0,0,0,0,0,0,0,0,0,0,0,0,0,0,0,0,0,0,0,0,0,0,0,0,0,0,0,0,0,0,0,0,0,0,0,0,0,0,0,0,0,0,0,0,0,0,0,0,0,0,0,0,0,0,0,0,0,0,4,9,4,5,10,9,14,7,7,9,6,7,7,6,2,0
Tungsten-Induced Denaturation and Aggregation of Epoetin Alfa During Primary Packaging as a Cause of Immunogenicity,"Seidl, Andreas; Hainzl, Otmar; Richter, Marleen; Fischer, Robert; Boehm, Stephan; Deutel, Britta; Hartinger, Martin; Windisch, Joerg; Casadevall, Nicole; London, Gerard Michel; Macdougall, Iain",,,,PHARMACEUTICAL RESEARCH,JUN 2012,2012,29,6,,,,1454,1467,,10.1007/s11095-011-0621-4,,,104,11.56,0,0,0,0,0,0,0,0,0,0,0,0,0,0,0,0,0,0,0,0,0,0,0,0,0,0,0,0,0,0,0,0,0,0,0,0,0,0,0,0,0,0,0,0,0,0,0,0,0,0,0,0,0,0,0,0,0,0,0,0,0,0,0,0,0,0,0,0,0,0,0,0,0,0,0,0,0,0,0,0,0,0,0,0,0,0,0,0,0,0,0,0,0,0,0,0,0,0,0,0,0,0,0,0,0,0,0,0,0,0,0,0,8,15,15,11,19,10,13,8,5,0
A framework for the study of zoonotic disease emergence and its drivers: spillover of bat pathogens as a case study,"Wood, James L. N.; Leach, Melissa; Waldman, Linda; MacGregor, Hayley; Fooks, Anthony R.; Jones, Kate E.; Restif, Olivier; Dechmann, Dina; Hayman, David T. S.; Baker, Kate S.; Peel, Alison J.; Kamins, Alexandra O.; Fahr, Jakob; Ntiamoa-Baidu, Yaa; Suu-Ire, Richard; Breiman, Robert F.; Epstein, Jonathan H.; Field, Hume E.; Cunningham, Andrew A.",,,,PHILOSOPHICAL TRANSACTIONS OF THE ROYAL SOCIETY B-BIOLOGICAL SCIENCES,OCT 19 2012,2012,367,1604,,,,2881,2892,,10.1098/rstb.2012.0228,,,99,11,0,0,0,0,0,0,0,0,0,0,0,0,0,0,0,0,0,0,0,0,0,0,0,0,0,0,0,0,0,0,0,0,0,0,0,0,0,0,0,0,0,0,0,0,0,0,0,0,0,0,0,0,0,0,0,0,0,0,0,0,0,0,0,0,0,0,0,0,0,0,0,0,0,0,0,0,0,0,0,0,0,0,0,0,0,0,0,0,0,0,0,0,0,0,0,0,0,0,0,0,0,0,0,0,0,0,0,0,0,0,0,0,2,10,13,16,14,16,15,8,5,0
Using multi-scale modelling to predict habitat suitability for species of conservation concern: The grey long-eared bat as a case study,"Razgour, Orly; Hanmer, Julia; Jones, Gareth",,,,BIOLOGICAL CONSERVATION,DEC 2011,2011,144,12,,,,2922,2930,,10.1016/j.biocon.2011.08.010,,,93,9.3,0,0,0,0,0,0,0,0,0,0,0,0,0,0,0,0,0,0,0,0,0,0,0,0,0,0,0,0,0,0,0,0,0,0,0,0,0,0,0,0,0,0,0,0,0,0,0,0,0,0,0,0,0,0,0,0,0,0,0,0,0,0,0,0,0,0,0,0,0,0,0,0,0,0,0,0,0,0,0,0,0,0,0,0,0,0,0,0,0,0,0,0,0,0,0,0,0,0,0,0,0,0,0,0,0,0,0,0,0,0,0,0,2,12,12,12,13,11,16,9,6,0
"Bats, Civets and the emergence of SARS","Wang, L.-F.; Eaton, B. T.",,,"Childs, JE; Mackenzie, JS; Richt, JA","WILDLIFE AND EMERGING ZOONOTIC DISEASES: THE BIOLOGY, CIRCUMSTANCES AND CONSEQUENCES OF CROSS-SPECIES TRANSMISSION",2007,2007,315,,,,,325,344,,,,,92,6.57,0,0,0,0,0,0,0,0,0,0,0,0,0,0,0,0,0,0,0,0,0,0,0,0,0,0,0,0,0,0,0,0,0,0,0,0,0,0,0,0,0,0,0,0,0,0,0,0,0,0,0,0,0,0,0,0,0,0,0,0,0,0,0,0,0,0,0,0,0,0,0,0,0,0,0,0,0,0,0,0,0,0,0,0,0,0,0,0,0,0,0,0,0,0,0,0,0,0,0,0,0,0,0,0,0,0,0,0,4,9,4,4,7,7,12,11,4,7,2,6,15,0
"Establishment, Immortalisation and Characterisation of Pteropid Bat Cell Lines","Crameri, Gary; Todd, Shawn; Grimley, Samantha; McEachern, Jennifer A.; Marsh, Glenn A.; Smith, Craig; Tachedjian, Mary; De Jong, Carol; Virtue, Elena R.; Yu, Meng; Bulach, Dieter; Liu, Jun-Ping; Michalski, Wojtek P.; Middleton, Deborah; Field, Hume E.; Wang, Lin-Fa",,,,PLOS ONE,DEC 11 2009,2009,4,12,,,,,,e8266,10.1371/journal.pone.0008266,,,90,7.5,0,0,0,0,0,0,0,0,0,0,0,0,0,0,0,0,0,0,0,0,0,0,0,0,0,0,0,0,0,0,0,0,0,0,0,0,0,0,0,0,0,0,0,0,0,0,0,0,0,0,0,0,0,0,0,0,0,0,0,0,0,0,0,0,0,0,0,0,0,0,0,0,0,0,0,0,0,0,0,0,0,0,0,0,0,0,0,0,0,0,0,0,0,0,0,0,0,0,0,0,0,0,0,0,0,0,0,0,0,0,1,9,14,12,9,6,7,5,9,10,8,0
Deciphering the bat virome catalog to better understand the ecological diversity of bat viruses and the bat origin of emerging infectious diseases,"Wu, Zhiqiang; Yang, Li; Ren, Xianwen; He, Guimei; Zhang, Junpeng; Yang, Jian; Qian, Zhaohui; Dong, Jie; Sun, Lilian; Zhu, Yafang; Du, Jiang; Yang, Fan; Zhang, Shuyi; Jin, Qi",,,,ISME JOURNAL,MAR 2016,2016,10,3,,,,609,620,,10.1038/ismej.2015.138,,,89,17.8,0,0,0,0,0,0,0,0,0,0,0,0,0,0,0,0,0,0,0,0,0,0,0,0,0,0,0,0,0,0,0,0,0,0,0,0,0,0,0,0,0,0,0,0,0,0,0,0,0,0,0,0,0,0,0,0,0,0,0,0,0,0,0,0,0,0,0,0,0,0,0,0,0,0,0,0,0,0,0,0,0,0,0,0,0,0,0,0,0,0,0,0,0,0,0,0,0,0,0,0,0,0,0,0,0,0,0,0,0,0,0,0,0,0,0,0,10,15,20,23,21,0
Further Evidence for Bats as the Evolutionary Source of Middle East Respiratory Syndrome Coronavirus,"Anthony, S. J.; Gilardi, K.; Menachery, V. D.; Goldstein, T.; Ssebide, B.; Mbabazi, R.; Navarrete-Macias, I.; Liang, E.; Wells, H.; Hicks, A.; Petrosov, A.; Byarugaba, D. K.; Debbink, K.; Dinnon, K. H.; Scobey, T.; Randell, S. H.; Yount, B. L.; Cranfield, M.; Johnson, C. K.; Baric, R. S.; Lipkin, W. I.; Mazet, J. A. K.",,,,MBIO,MAR-APR 2017,2017,8,2,,,,,,e00373-17,10.1128/mBio.00373-17,,,88,22,0,0,0,0,0,0,0,0,0,0,0,0,0,0,0,0,0,0,0,0,0,0,0,0,0,0,0,0,0,0,0,0,0,0,0,0,0,0,0,0,0,0,0,0,0,0,0,0,0,0,0,0,0,0,0,0,0,0,0,0,0,0,0,0,0,0,0,0,0,0,0,0,0,0,0,0,0,0,0,0,0,0,0,0,0,0,0,0,0,0,0,0,0,0,0,0,0,0,0,0,0,0,0,0,0,0,0,0,0,0,0,0,0,0,0,0,0,11,17,33,27,0
What do we know about the yeast strains from the Brazilian fuel ethanol industry?,"Della-Bianca, Bianca Eli; Basso, Thiago Olitta; Stambuk, Boris Ugarte; Basso, Luiz Carlos; Gombert, Andreas Karoly",,,,APPLIED MICROBIOLOGY AND BIOTECHNOLOGY,FEB 2013,2013,97,3,,,,979,991,,10.1007/s00253-012-4631-x,,,86,10.75,0,0,0,0,0,0,0,0,0,0,0,0,0,0,0,0,0,0,0,0,0,0,0,0,0,0,0,0,0,0,0,0,0,0,0,0,0,0,0,0,0,0,0,0,0,0,0,0,0,0,0,0,0,0,0,0,0,0,0,0,0,0,0,0,0,0,0,0,0,0,0,0,0,0,0,0,0,0,0,0,0,0,0,0,0,0,0,0,0,0,0,0,0,0,0,0,0,0,0,0,0,0,0,0,0,0,0,0,0,0,0,0,0,4,6,7,11,22,12,15,9,0
The deadly coronaviruses: The 2003 SARS pandemic and the 2020 novel coronavirus epidemic in China,"Yang, Yongshi; Peng, Fujun; Wang, Runsheng; Guan, Kai; Jiang, Taijiao; Xu, Guogang; Sun, Jinlyu; Chang, Christopher",,,,JOURNAL OF AUTOIMMUNITY,MAY 2020,2020,109,,,,,,,102434,10.1016/j.jaut.2020.102434,,,78,78,0,0,0,0,0,0,0,0,0,0,0,0,0,0,0,0,0,0,0,0,0,0,0,0,0,0,0,0,0,0,0,0,0,0,0,0,0,0,0,0,0,0,0,0,0,0,0,0,0,0,0,0,0,0,0,0,0,0,0,0,0,0,0,0,0,0,0,0,0,0,0,0,0,0,0,0,0,0,0,0,0,0,0,0,0,0,0,0,0,0,0,0,0,0,0,0,0,0,0,0,0,0,0,0,0,0,0,0,0,0,0,0,0,0,0,0,0,0,0,0,78,0
